香港中华煤气有限公司,HKCGAS 3.76 08/26/25,-,3.76,-,380.00 百万,2022/8/26,--,--,产业债,104326,2025/8/26
联想集团有限公司,LENOVO 2.5 08/26/29,100.35,2.5,-,675.00 百万,2022/8/26,--,2026/8/26,产业债,104334,2029/8/26
海通国际证券集团有限公司,HTISEC 4.1 08/24/23,-,4.1,-,51.00 百万,2022/8/26,--,--,金融债,104337,2023/8/24
常德市城市建设投资集团有限公司,CHADEC 5.7 08/26/25,-,5.7,-,200.00 百万,2022/8/26,根据可持续发展融资框架，对部分现有债务和符合条件的项目进行再融资,--,城投债,104354,2025/8/26
国泰君安国际控股有限公司,GUOTJU 3.95 08/24/23,-,3.95,-,50.00 百万,2022/8/26,--,--,金融债,104355,2023/8/24
西安未央城市建设集团有限公司,WYURBN 5.1 08/24/25,-,5.1,-,74.50 百万,2022/8/24,用于项目建设和补充运营资金,--,城投债,104325,2025/8/24
龙南旅游发展投资(集团)有限责任公司,LTDIGC 6 07/24/25,-,6,-,96.00 百万,2022/8/24,为建设项目进行融资，和用于一般公司用途,--,城投债,104327,2025/7/24
海通国际证券集团有限公司,HTISEC 4.25 08/23/23,-,4.25,-,20.00 百万,2022/8/24,--,--,金融债,104336,2023/8/23
中华人民共和国,PBOCIN 1.9 11/23/22,-,1.9,-,10000.00 百万,2022/8/24,--,--,政府债,104356,2022/11/23
中华人民共和国,PBOCIN 2.3 08/24/23,-,2.3,-,15000.00 百万,2022/8/24,--,--,政府债,104357,2023/8/24
中华人民共和国(香港特区政府),HKGB 2.84 08/22/24,-,2.84,-,1200.00 百万,2022/8/22,--,--,政府债,104295,2024/8/22
中国国际金融(国际)有限公司,CICCHK 1.2 09/22/22,-,1.2,-,2.00 百万,2022/8/22,--,--,金融债,104298,2022/9/22
广州产业投资基金管理有限公司,HIGHKY 6 08/18/23,-,6,-,41.00 百万,2022/8/19,偿还离岸债务和一般企业用途,--,金融债,104296,2023/8/18
天津临港投资控股有限公司,TJHARB 5.5 08/19/25,-,5.5,-,41.00 百万,2022/8/19,再融资,--,城投债,104297,2025/8/19
东亚银行有限公司,KGIINT 0.01 02/21/23,-,0.01,-,1.00 百万,2022/8/19,--,--,金融债,104328,2023/2/21
中华人民共和国(香港特区政府),GBHK Float 08/18/23,-,O/N HONIA+45,-,1500.00 百万,2022/8/18,--,--,政府债,104273,2023/8/18
山东海运股份有限公司,SDSHIP 5 08/18/25,-,5,-,200.00 百万,2022/8/18,主要用于偿还2022年到期的离岸债务，剩余发行所得将用于补充流动性,--,产业债,104286,2025/8/18
海宁市城市发展投资集团有限公司,HNCDIN 3.8 08/18/25,-,3.8,-,1000.00 百万,2022/8/18,运营资本，项目融资,--,城投债,104288,2025/8/18
江苏句容投资集团有限公司,JSJRIG 3.5 08/18/25,-,3.5,-,46.50 百万,2022/8/18,运营资本，项目融资,--,城投债,104289,2025/8/18
安徽伯阳城建控股集团有限公司,BYURCN 5.5 08/18/25,-,5.5,-,50.00 百万,2022/8/18,一般业务用途，运营资本,--,城投债,104290,2025/8/18
无锡市城开实业发展集团有限公司,WXCKIN 2.95 08/17/25,-,2.95,-,160.00 百万,2022/8/17,为项目建设融资和补充运营资本,--,城投债,104283,2025/8/17
国家开发银行,SDBC 3 08/16/24,-,3,-,750.00 百万,2022/8/17,--,--,金融债,104291,2024/8/16
宿州市城市建设投资集团(控股)有限公司,SZCONS 5.5 08/16/25,-,5.5,-,100.00 百万,2022/8/16,为离岸债券进行再融资,--,城投债,104284,2025/8/16
滨州市滨城区经济开发投资有限公司,BIBIDI 4.8 08/16/25,-,4.8,-,28.20 百万,2022/8/16,为建设项目进行融资，补充集团营运资金和用于一般公司用途,--,城投债,104287,2025/8/16
香港机场管理局,HKAA 3.2 08/15/27,-,3.2,-,365.00 百万,2022/8/15,--,--,产业债,104266,2027/8/15
香港铁路有限公司,MTRC 3.25 08/15/24,-,3.25,-,500.00 百万,2022/8/15,--,--,产业债,104275,2024/8/15
绿景(中国)地产投资有限公司,LVGEM 6 08/11/23,-,6,-,174.60 百万,2022/8/12,一般业务用途，再融资,--,地产债,104277,2023/8/11
绿景(中国)地产投资有限公司,LVGEM 6 08/11/23,-,6,-,8.75 百万,2022/8/12,一般业务用途，再融资,--,地产债,104279,2023/8/11
邵东市城市发展集团有限公司,SDCDGP 3.2 08/12/25,-,3.2,-,147.00 百万,2022/8/12,一般业务用途，运营资本，项目融资,--,城投债,104280,2025/8/12
中华人民共和国,CGB 2.82 08/12/32,-,2.82,-,1000.00 百万,2022/8/12,--,--,政府债,104282,2032/8/12
蚌埠高新投资集团有限公司,BHHNIV 5.3 08/11/25,-,5.3,-,200.00 百万,2022/8/11,再融资,--,城投债,104270,2025/8/11
中信证券国际有限公司,CSILTD Float 02/11/23,-,O/N SOFR FLAT,-,5.00 百万,2022/8/11,--,--,金融债,104333,2023/2/11
丹阳投资集团有限公司,PHCIIL 6.4 08/10/25,90.055,6.4,10.384,205.00 百万,2022/8/10,未偿离岸债务再融资,--,城投债,104267,2025/8/10
华泰国际金融控股有限公司,HTIFIH 2 11/10/22,-,2,-,300.00 百万,2022/8/10,运营资本,--,金融债,104268,2022/11/10
华泰国际金融控股有限公司,HTIFIH 3 08/09/23,-,3,-,15.00 百万,2022/8/10,运营资本,--,金融债,104271,2023/8/9
华泰国际金融控股有限公司,HTIFIH 3 12/23/22,-,3,-,75.00 百万,2022/8/10,--,--,金融债,104272,2022/12/23
苏州工业园区国有资本投资运营控股有限公司,SIPPRO 3.6 08/10/32,-,3.6,-,300.00 百万,2022/8/10,用作项目建设和补充运营资本,2027/8/10,城投债,104278,2032/8/10
济南高新控股集团有限公司,JNHITE 5.5 08/09/25,100.406,5.5,5.348,300.00 百万,2022/8/9,为发行人2022年到期的离岸债券再融资，为建设项目融资和一般运营资本,--,城投债,104261,2025/8/9
宿州市城市建设投资集团(控股)有限公司,SZCONS 6 08/09/25,99.721,6,6.102,200.00 百万,2022/8/9,为公司离岸债务再融资,--,城投债,104263,2025/8/9
香港机场管理局,HKAA 3.3 08/08/27,-,3.3,-,575.00 百万,2022/8/8,--,--,产业债,104242,2027/8/8
绵阳市投资控股(集团)有限公司,MIANYA 6.7 08/08/25,100.675,6.7,6.443,300.00 百万,2022/8/8,为发行人的现有离岸债务进行再融资,--,城投债,104260,2025/8/8
武汉城市建设集团有限公司,BCHINA 2.25 07/09/24,-,2.25,-,2.75 百万,2022/8/5,--,--,城投债,104262,2024/7/9
绍兴市柯桥区建设集团有限公司,SXKEQO 4.35 08/04/25,-,4.35,-,1000.00 百万,2022/8/4,--,--,城投债,104253,2025/8/4
江苏句容投资集团有限公司,JSJRIG 2.9 08/04/25,-,2.9,-,135.00 百万,2022/8/4,运营资本，项目融资,--,城投债,104254,2025/8/4
中国银行股份有限公司,BCHINA 2.95 08/03/25,-,2.95,-,2500.00 百万,2022/8/3,一般公司用途,--,金融债,104244,2025/8/3
宁波市海曙开发建设投资集团有限公司,NBHSDC 3.1 08/02/25,-,3.1,-,90.00 百万,2022/8/2,用于项目建设和一般运营资本,--,城投债,104239,2025/8/2
泰兴市襟江投资有限公司,TXJJIN 3.5 07/02/25,-,3.5,-,30.00 百万,2022/8/2,补充运营资金,--,城投债,104240,2025/7/2
山东国惠投资控股集团有限公司,SHGUOH 5.3 08/01/25,-,5.3,-,110.00 百万,2022/8/1,用于偿还集团离岸债务和用于租赁项目,--,城投债,104237,2025/8/1
西安世园投资(集团)有限公司,XIANGR 4.5 07/01/25,-,4.5,-,71.00 百万,2022/8/1,--,--,城投债,104243,2025/7/1
湖州市南浔区交通投资集团有限公司,NXDTIN 5 08/01/25,-,5,-,490.00 百万,2022/8/1,用于项目建设和补充运营资本,--,城投债,104245,2025/8/1
象山县滨海投资有限公司,XSBHIN 2.6 08/01/25,-,2.6,-,72.00 百万,2022/8/1,运营资本、项目融资,--,城投债,104178,2025/8/1
青岛市即墨区城市开发投资有限公司,JMUDIV 4.9 07/29/25,-,4.9,-,261.00 百万,2022/7/29,用于项目建设、补充运营资本和偿还离岸债务,--,城投债,104232,2025/7/29
深圳市卓越商业管理有限公司,EXCECP 4.3 07/29/25,-,4.3,-,100.00 百万,2022/7/29,根据绿色和可持续融资框架，对公司现有的离岸债务进行再融资,--,地产债,104236,2025/7/29
中国银行股份有限公司,BCHINA 3.25 03/04/25,-,3.25,-,13.53 百万,2022/7/28,--,--,金融债,104229,2025/3/4
中国银行股份有限公司,BCHINA 3.6 03/04/25,-,3.6,-,2.00 百万,2022/7/28,--,--,金融债,104235,2025/3/4
杭州上城区城市建设投资集团有限公司,ZJBOXV 3.99 07/27/23,-,3.99,-,300.00 百万,2022/7/28,用于项目建设和补充运营资本,--,城投债,104238,2023/7/27
扬州市江都沿江开发有限公司,YZJNDU 5.2 07/27/23,-,5.2,-,40.00 百万,2022/7/28,一般业务用途,--,城投债,104241,2023/7/27
广州开发区投资集团有限公司,GETDZS 4.5 07/28/25,98.014,4.5,5.238,400.00 百万,2022/7/28,债券的净收益将用于集团合格项目的融资，包括集团可持续融资框架中定义的“合格绿色项目”和“合格社会项目”，以及相关的营运资金用途,--,城投债,104179,2025/7/28
中国长江三峡集团有限公司,YANTZE 3.625 07/28/25,99.682,3.625,3.739,300.00 百万,2022/7/28,为现有债务进行再融资和一般公司用途,2025/6/28,产业债,104180,2025/7/28
国家开发银行,SDBC 3.3 07/28/25,-,3.3,-,100.00 百万,2022/7/28,--,--,金融债,104181,2025/7/28
蓬莱阁(烟台市蓬莱区)旅游有限责任公司,PENLAC 5.5 07/27/25,-,5.5,-,57.00 百万,2022/7/27,用于项目建设和补充运营资金,--,城投债,104226,2025/7/27
蓬莱阁(烟台市蓬莱区)旅游有限责任公司,PENLAC 5.3 07/27/25,-,5.3,-,63.00 百万,2022/7/27,运营资本,--,城投债,104228,2025/7/27
漳州市九龙江集团有限公司,BCHINA 4.4 07/27/25,-,4.4,-,7.44 百万,2022/7/27,--,--,城投债,104233,2025/7/27
平安不动产资本有限公司,BCHINA 3.45 07/29/26,-,3.45,-,3.00 百万,2022/7/27,--,--,金融债,104234,2026/7/29
创兴银行有限公司,CHOHIN 4.9 07/27/32,-,4.9,-,224.00 百万,2022/7/27,巴塞尔协议III 2级资本,2027/7/27,金融债,104246,2032/7/27
重庆盈地实业(集团)有限公司,CQYDIN 2.5 06/27/25,-,2.5,-,27.00 百万,2022/7/27,一般业务用途、运营资本,--,城投债,104097,2025/6/27
联想集团有限公司,LENOVO 5.831 01/27/28,99.188,5.831,6.007,625.00 百万,2022/7/27,票据收益根据要约备忘录中规定的条款，购买2022年7月18日的要约备忘录中的若干证券,2027/12/27,产业债,104099,2028/1/27
联想集团有限公司,LENOVO 6.536 07/27/32,98.17,6.536,6.791,625.00 百万,2022/7/27,票据收益根据绿色融资框架，净收益的等额全部或部分用于发行人的一个或多个合格的新或现有项目(如绿色建筑和可再生能源项目)的融资或再融资,2032/4/27,产业债,104100,2032/7/27
联想集团有限公司,LENOVO 5.831 01/27/28,99.188,5.831,6.007,625.00 百万,2022/7/27,票据收益根据要约备忘录中规定的条款，购买2022年7月18日的要约备忘录中的若干证券,2027/12/27,产业债,104101,2028/1/27
联想集团有限公司,LENOVO 6.536 07/27/32,98.17,6.536,6.791,625.00 百万,2022/7/27,票据收益根据绿色融资框架，净收益的等额全部或部分用于发行人的一个或多个合格的新或现有项目(如绿色建筑和可再生能源项目)的融资或再融资,2032/4/27,产业债,104102,2032/7/27
漳州市九龙江集团有限公司,ZHAPIE 4.7 07/27/25,99.675,4.7,4.819,500.00 百万,2022/7/27,根据国家发改委证书和可持续金融框架对未偿离岸债务进行再融资,--,城投债,104103,2025/7/27
绍兴市城市建设投资集团有限公司,SXUCI 3.3 07/27/25,-,3.3,-,500.00 百万,2022/7/27,一般业务用途,--,城投债,104117,2025/7/27
中国银行(香港)有限公司,BCHINA 5.9 09/14/23,-,5.9,-,2.20 百万,2022/7/26,--,--,金融债,104105,2023/9/14
中国银行股份有限公司,BCHINA 3.6 03/04/25,-,3.6,-,2.20 百万,2022/7/26,--,--,金融债,104106,2025/3/4
香港铁路有限公司,MTRC 3.11 07/25/25,-,3.11,-,250.00 百万,2022/7/25,--,--,产业债,104088,2025/7/25
交通银行股份有限公司,BCHINA 3.8 11/18/25,-,3.8,-,2.20 百万,2022/7/25,--,--,金融债,104095,2025/11/18
台湾积体电路制造股份有限公司,TAISEM 4.625 07/22/32,-,4.625,-,600.00 百万,2022/7/22,一般业务用途,2032/4/22,产业债,104255,2032/7/22
台湾积体电路制造股份有限公司,TAISEM 4.375 07/22/27,-,4.375,-,400.00 百万,2022/7/22,一般企业用途,2027/6/22,产业债,104257,2027/7/22
台湾积体电路制造股份有限公司,TAISEM 4.625 07/22/32,-,4.625,-,600.00 百万,2022/7/22,一般业务用途,2032/4/22,产业债,104258,2032/7/22
台湾积体电路制造股份有限公司,TAISEM 4.375 07/22/27,-,4.375,-,400.00 百万,2022/7/22,一般企业用途,2027/6/22,产业债,104259,2027/7/22
中国进出口银行,EXIMCH 3 07/22/24,99.23,3,3.418,100.00 百万,2022/7/22,--,--,金融债,104080,2024/7/22
绍兴市上虞城市建设集团有限公司,SHYUCD 3.9 07/22/25,-,3.9,-,1100.00 百万,2022/7/22,运营资本、项目融资,--,城投债,104081,2025/7/22
中国银行股份有限公司,BCHINA 3.45 03/04/25,-,3.45,-,67.80 百万,2022/7/22,--,--,金融债,104082,2025/3/4
中国建设银行股份有限公司,BCHINA 3.76 02/27/24,-,3.76,-,44.07 百万,2022/7/22,--,--,金融债,104083,2024/2/27
江苏世纪新城投资控股集团有限公司,YCCNCC 6.5 07/21/23,-,6.5,-,115.00 百万,2022/7/22,为现有债务再融资和一般企业用途,--,城投债,104089,2023/7/21
平安不动产资本有限公司,BCHINA 3.45 07/29/26,-,3.45,-,2.00 百万,2022/7/22,--,--,金融债,104092,2026/7/29
泰兴市智光环保科技有限公司,ZGENV 2 07/21/23,-,2,-,50.00 百万,2022/7/22,--,--,产业债,104093,2023/7/21
平安不动产资本有限公司,BCHINA 3.45 07/29/26,-,3.45,-,2.00 百万,2022/7/22,--,--,金融债,104094,2026/7/29
南山集团有限公司,NNSHAN 5.5 06/19/23,-,5.5,-,94.70 百万,2022/7/22,一般业务用途、运营资本,--,产业债,104104,2023/6/19
大连德泰控股有限公司,DLDETA 5 07/21/25,-,5,-,30.00 百万,2022/7/21,--,--,城投债,104078,2025/7/21
香港铁路有限公司,MTRC 3.05 07/21/25,-,3.05,-,251.00 百万,2022/7/21,--,--,产业债,104079,2025/7/21
汇景控股有限公司,HUIJHK 12.5 07/20/23,97.5,12.5,15.523,107.60 百万,2022/7/21,--,--,地产债,104087,2023/7/20
都江堰岷江水务集团有限公司,DJYXSW 5 07/21/25,-,5,-,60.00 百万,2022/7/21,一般业务用途、运营资本,--,城投债,104091,2025/7/21
福建漳龙集团有限公司,ZHANLO 4.8 06/20/25,98.921,4.8,5.215,500.00 百万,2022/7/20,根据公司的绿色金融框架，为合格项目提供融资或再融资,--,城投债,104074,2025/6/20
国家开发银行,SDBC 2.85 07/19/24,-,2.85,-,3500.00 百万,2022/7/19,用作运营资本和一般企业用途,--,金融债,104064,2024/7/19
国家开发银行,SDBC 2.95 07/19/27,-,2.95,-,2500.00 百万,2022/7/19,用作运营资本和一般企业用途,--,金融债,104065,2027/7/19
中国建设银行股份有限公司,BCHINA 2.78 01/21/27,-,2.78,-,53.95 百万,2022/7/19,--,--,金融债,104075,2027/1/21
中国进出口银行,EXIMCH 3 07/18/24,99.236,3,3.417,100.00 百万,2022/7/18,--,--,金融债,104050,2024/7/18
上坤地产集团有限公司,SUNKWP 12.25 07/17/23,-,12.25,-,222.36 百万,2022/7/18,--,--,地产债,104084,2023/7/17
中国进出口银行,EXIMCH 2.875 07/15/24,99.013,2.875,3.416,100.00 百万,2022/7/15,--,--,金融债,104041,2024/7/15
淮安市交通控股集团有限公司,HACOMM 5.5 07/15/25,-,5.5,-,300.00 百万,2022/7/15,现有离岸债务再融资,--,城投债,104043,2025/7/15
济南市中财金投资集团有限公司,JNSZFI 5.1 07/14/23,-,5.1,-,100.00 百万,2022/7/15,用于一般公司用途,--,城投债,104048,2023/7/14
高邮市建设投资发展集团有限公司,GYCONS 4.3 07/15/25,-,4.3,-,46.00 百万,2022/7/15,用于项目建设和补充运营资本,--,城投债,104066,2025/7/15
中国银行股份有限公司,BCHINA 3.25 07/11/23,-,3.25,-,20.00 百万,2022/7/15,--,--,金融债,104067,2023/7/11
中国银行股份有限公司,BCHINA 2.85 01/25/25,-,2.85,-,1.50 百万,2022/7/15,--,--,金融债,104068,2025/1/25
中国银行股份有限公司,BCHINA 3.25 07/11/23,-,3.25,-,20.00 百万,2022/7/15,--,--,金融债,104069,2023/7/11
中国银行股份有限公司,BCHINA 3.25 07/11/23,-,3.25,-,20.00 百万,2022/7/15,--,--,金融债,104070,2023/7/11
宝龙地产控股有限公司,PWRLNG 4 07/14/23,16.882,4,360.34,169.77 百万,2022/7/15,--,2022/7/14,地产债,104076,2023/7/14
宝龙地产控股有限公司,PWRLNG 7.125 01/15/24,12.281,7.125,257.727,262.74 百万,2022/7/15,--,2022/7/14,地产债,104077,2024/1/15
北京燃气蓝天控股有限公司,BGBSP 4 07/14/23,-,4,-,30.00 百万,2022/7/15,--,--,产业债,104090,2023/7/14
上海浦东发展银行股份有限公司,SHANPU 3.25 07/14/25,99.001,3.25,3.616,400.00 百万,2022/7/14,根据浦发银行的绿色融资框架，发行债券的净收益等额将用于为合格的绿色资产或项目的融资和/或再融资,--,金融债,104042,2025/7/14
中国银行股份有限公司,BCHINA 3.25 07/07/23,-,3.25,-,20.00 百万,2022/7/14,--,--,金融债,104051,2023/7/7
中国银行股份有限公司,BCHINA 3.25 07/07/23,-,3.25,-,20.00 百万,2022/7/14,--,--,金融债,104052,2023/7/7
移卡有限公司,YEAHKA 6.25 07/13/27,-,6.25,-,70.00 百万,2022/7/13,--,2024/7/13、2025/7/13,产业债,104027,2027/7/13
济南济北新城供应链服务有限公司,JINANJ 1.9 06/12/23,-,1.9,-,40.00 百万,2022/7/13,用于该公司的贸易业务发展及偿还其有息债务,--,城投债,104030,2023/6/12
新疆中泰(集团)有限责任公司,XJZHTA 4 07/13/25,-,4,-,760.00 百万,2022/7/13,--,--,城投债,104035,2025/7/13
南京江北新区产业投资集团有限公司,IDINOS 4.4 07/11/23,99.903,4.4,4.508,270.00 百万,2022/7/12,离岸债务再融资和一般公司用途,--,城投债,104016,2023/7/11
广西交通投资集团有限公司,GXCMIN 3.95 07/12/25,98.747,3.95,4.416,300.00 百万,2022/7/12,为发行人于2022年9月到期的离岸债券再融资,--,城投债,104026,2025/7/12
西安市灞桥投资控股集团有限公司,XIBAIN 4.1 05/12/25,99.623,4.1,4.238,58.00 百万,2022/7/12,补充营运资本,--,城投债,104031,2025/5/12
中国进出口银行,EXIMCH 2.875 07/12/24,99.019,2.875,3.416,100.00 百万,2022/7/12,--,--,金融债,104038,2024/7/12
陕西金融资产管理股份有限公司,BCHINA 3.2 03/18/24,-,3.2,-,6.00 百万,2022/7/12,--,--,金融债,104045,2024/3/18
武汉地铁集团有限公司,BCHINA 2.96 09/24/24,-,2.96,-,6.00 百万,2022/7/12,--,--,城投债,104046,2024/9/24
江苏中南建设集团股份有限公司,JIAZHO 12 06/05/23,-,12,-,26.48 百万,2022/7/12,--,2023/6/5,地产债,104049,2023/6/5
开山集团股份有限公司,KGIINT 1 07/08/25,-,1,-,15.00 百万,2022/7/12,--,--,产业债,104053,2025/7/8
广州富力地产股份有限公司,GZRFPR 7.5 07/11/25,21.108,7.5,80.589,1292.39 百万,2022/7/11,--,2022/7/11,地产债,104071,2025/7/11
广州富力地产股份有限公司,GZRFPR 7.5 07/11/27,17.446,7.5,75.834,2203.66 百万,2022/7/11,--,2022/7/11,地产债,104072,2027/7/11
广州富力地产股份有限公司,GZRFPR 7.5 07/11/28,10.837,7.5,89.983,1605.82 百万,2022/7/11,--,2022/7/11,地产债,104073,2028/7/11
香港中华煤气有限公司,HKCGAS 4.1 07/08/32,-,4.1,-,350.00 百万,2022/7/8,资本支出、一般公司用途和再融资,--,产业债,103996,2032/7/8
香港铁路有限公司,MTRC 3.45 07/08/25,-,3.45,-,750.00 百万,2022/7/8,--,--,产业债,103997,2025/7/8
青岛城市建设投资(集团)有限责任公司,HKIQCL 4.8 07/08/25,97.674,4.8,5.687,750.00 百万,2022/7/8,为现有一年内到期离岸债务再融资,--,城投债,104012,2025/7/8
东亚银行有限公司,BNKEA 5.125 07/07/28,99.033,5.125,5.351,250.00 百万,2022/7/7,一般公司用途,2027/7/7,金融债,104011,2028/7/7
中国建设银行股份有限公司,BCHINA 2.45 06/24/25,-,2.45,-,1.00 百万,2022/7/7,--,--,金融债,104017,2025/6/24
中国工商银行股份有限公司,BCHINA 3.51 09/23/25,-,3.51,-,13.40 百万,2022/7/7,--,--,金融债,104018,2025/9/23
中国银行股份有限公司,BCHINA 2.8 11/04/23,-,2.8,-,2.10 百万,2022/7/7,--,--,金融债,104022,2023/11/4
交通银行股份有限公司,BCHINA 3.73 11/18/25,-,3.73,-,20.10 百万,2022/7/7,--,--,金融债,104023,2025/11/18
交通银行股份有限公司,BCHINA 3.88 11/18/25,-,3.88,-,13.39 百万,2022/7/7,--,--,金融债,104033,2025/11/18
中国工商银行股份有限公司,BCHINA 3.65 09/23/25,-,3.65,-,20.08 百万,2022/7/7,--,--,金融债,104034,2025/9/23
中信证券国际有限公司,CSILTD 18.24 10/12/22,-,18.24,-,3.50 百万,2022/7/6,--,--,金融债,103990,2022/10/12
德清县文化旅游发展集团有限公司,DQWHLV 5.37 07/06/25,-,5.37,-,195.00 百万,2022/7/6,用于项目融资和一般公司用途,--,城投债,104008,2025/7/6
中国中铁股份有限公司,CHRAIL 4 07/06/27,100.003,4,3.998,500.00 百万,2022/7/6,为集团的离岸现有债务进行再融资和一般公司用途,--,产业债,104010,2027/7/6
成都经开产业投资集团有限公司,CDECTH 5.5 07/06/25,100.25,5.5,5.402,200.00 百万,2022/7/6,现有离岸债务再融资,--,城投债,104013,2025/7/6
中国国际金融(国际)有限公司,CICCHK 0.8 08/05/22,-,0.8,-,2.00 百万,2022/7/6,--,--,金融债,104014,2022/8/5
三花控股集团有限公司,KGIINT 1 07/25/23,-,1,-,20.00 百万,2022/7/6,--,--,金融债,104019,2023/7/25
中国农业银行股份有限公司,AGRBK 3.3 07/05/23,-,3.3,-,100.00 百万,2022/7/6,--,--,金融债,104167,2023/7/5
恒基兆业地产有限公司,HENLND 3.7 07/05/24,-,3.7,-,500.00 百万,2022/7/5,--,--,地产债,103994,2024/7/5
内江投资控股集团有限公司,NEJAIN 5 06/05/25,-,5,-,30.00 百万,2022/7/5,对本公司现有的于一年内到期的中长期离岸债务进行再融资,--,城投债,104009,2025/6/5
交通银行(香港)有限公司,BCHINA 3.58 03/03/25,-,3.58,-,6.68 百万,2022/7/5,--,--,金融债,104015,2025/3/3
中国银行股份有限公司,BCHINA 3.1 07/03/23,-,3.1,-,50.00 百万,2022/7/5,--,--,金融债,104169,2023/7/3
中国银行股份有限公司,BCHINA 3.3 07/03/23,-,3.3,-,100.00 百万,2022/7/5,--,--,金融债,104172,2023/7/3
仁寿兴新工业投资有限公司,RENSXI 2.7 06/30/25,-,2.7,-,48.00 百万,2022/6/30,运营资本,--,城投债,103988,2025/6/30
成都天府大港集团有限公司,CDTFDG 5 06/30/25,-,5,-,29.50 百万,2022/6/30,运营资本，项目融资,--,城投债,104006,2025/6/30
成都天府大港集团有限公司,CDTFDG 5 06/30/25,-,5,-,22.00 百万,2022/6/30,运营资本，项目融资,--,城投债,104007,2025/6/30
中国银行股份有限公司,BCHINA 3.35 06/29/23,-,3.35,-,50.00 百万,2022/6/30,--,--,金融债,104186,2023/6/29
工银国际租赁财务有限公司,ICBCIL Float 06/28/23,-,O/N SOFR +83,-,80.00 百万,2022/6/29,--,--,金融债,103986,2023/6/28
工银国际租赁财务有限公司,ICBCIL Float 06/28/23,-,O/N SOFR +83,-,220.00 百万,2022/6/29,--,--,金融债,103987,2023/6/28
遵义道桥建设(集团)有限公司,ZYRDBG 7.2 06/29/25,-,7.2,-,58.60 百万,2022/6/29,项目融资,--,城投债,103992,2025/6/29
国银金融租赁股份有限公司,CSILTD 0 06/27/25,-,0,-,45.00 百万,2022/6/29,--,--,金融债,103999,2025/6/27
中国建设银行股份有限公司,CSILTD 0 06/27/25,-,0,-,45.00 百万,2022/6/29,--,--,金融债,104000,2025/6/27
交通银行股份有限公司,CSILTD 0 06/27/25,-,0,-,45.00 百万,2022/6/29,--,--,金融债,104001,2025/6/27
中信证券国际有限公司,CSILTD 0 06/27/25,-,0,-,45.00 百万,2022/6/29,--,--,金融债,104002,2025/6/27
中国工商银行股份有限公司,BCHINA 3.58 09/23/25,-,3.58,-,33.47 百万,2022/6/29,--,--,金融债,104003,2025/9/23
中国工商银行股份有限公司,ICBCAS 2.85 06/28/23,-,2.85,-,1000.00 百万,2022/6/29,--,--,金融债,104152,2023/6/28
中国建设银行股份有限公司,CCB 2.8 06/28/23,-,2.8,-,1000.00 百万,2022/6/29,--,--,金融债,104175,2023/6/28
南山集团有限公司,NNSHAN 7 06/27/23,-,7,-,21.25 百万,2022/6/28,一般业务用途、运营资本,--,产业债,104230,2023/6/27
国家开发银行,SDBC Float 06/30/25,-,3mL+20,-,100.00 百万,2022/6/28,--,--,金融债,103983,2025/6/30
常德市经济建设投资集团有限公司,CHAECO 6.3 06/28/25,100.25,6.3,6.198,300.00 百万,2022/6/28,为集团的2022年8月到期的中长期离岸债务进行再融资,--,城投债,103989,2025/6/28
中国工商银行股份有限公司,BCHINA 3.15 09/24/26,-,3.15,-,8.05 百万,2022/6/28,--,--,金融债,103995,2026/9/24
南山集团有限公司,NNSHAN 7 06/27/23,-,7,-,103.75 百万,2022/6/28,运营资本,--,产业债,103998,2023/6/27
交通银行股份有限公司,BOCOM 3.3 06/27/23,-,3.3,-,50.00 百万,2022/6/28,--,--,金融债,104115,2023/6/27
交通银行股份有限公司,BOCOM 3.3 06/27/23,-,3.3,-,50.00 百万,2022/6/28,--,--,金融债,104127,2023/6/27
扬州市江都沿江开发有限公司,YZJNDU 3.8 06/26/23,-,3.8,-,20.00 百万,2022/6/27,一般业务用途,--,城投债,103982,2023/6/26
平安银行股份有限公司,PINANI 2.6 12/27/22,-,2.6,-,200.00 百万,2022/6/27,--,--,金融债,104122,2022/12/27
交通银行股份有限公司,BOCOM 3 06/27/24,-,3,-,1000.00 百万,2022/6/27,--,--,金融债,104157,2024/6/27
西安未央城市建设集团有限公司,WYURBN 4.6 06/24/25,-,4.6,-,96.50 百万,2022/6/24,用于项目建设和补充运营资金,--,城投债,103971,2025/6/24
晋江市路桥建设开发有限公司,JJUCID 4.5 06/23/23,-,4.5,-,142.00 百万,2022/6/24,项目建设，偿还现有债务和补充运营资本,--,城投债,103978,2023/6/23
临沂城市发展集团有限公司,LYCDIN 5.2 06/24/25,99.546,5.2,5.371,300.00 百万,2022/6/24,用于项目建设和营运资金补充,--,城投债,103979,2025/6/24
南山集团有限公司,NNSHAN 7 06/23/23,-,7,-,45.00 百万,2022/6/24,运营资本,--,产业债,103984,2023/6/23
乳山市水务集团有限公司,RUSHWA 4.5 06/23/23,-,4.5,-,28.50 百万,2022/6/24,一般企业用途,--,城投债,103985,2023/6/23
中国建设银行股份有限公司,CSILTD 0 03/05/24,-,0,-,5.00 百万,2022/6/24,--,--,金融债,103991,2024/3/5
领地控股集团有限公司,LEAHOL 12 06/23/23,-,12,-,119.43 百万,2022/6/24,--,2022/6/24,地产债,103993,2023/6/23
中国工商银行股份有限公司,ICBCAS 2.8 06/21/23,-,2.8,-,3500.00 百万,2022/6/24,--,--,金融债,104171,2023/6/21
中国银行股份有限公司,BCHINA 2.85 03/24/23,-,2.85,-,2000.00 百万,2022/6/24,--,--,金融债,104189,2023/3/24
国家开发银行,SDBC Float 06/23/25,-,3mL+22,-,100.00 百万,2022/6/23,--,--,金融债,103970,2025/6/23
中化香港(集团)有限公司,CSILTD 1.5 09/30/26,-,1.5,-,5.00 百万,2022/6/23,--,--,产业债,103974,2026/9/30
国银金融租赁股份有限公司,BCHINA 2.87 09/28/25,-,2.87,-,7.37 百万,2022/6/23,--,--,金融债,103975,2025/9/28
中化香港(集团)有限公司,CSILTD 1.5 09/30/26,-,1.5,-,5.00 百万,2022/6/23,--,--,产业债,103976,2026/9/30
中化香港(集团)有限公司,CSILTD 1.625 11/06/25,-,1.625,-,3.00 百万,2022/6/23,--,--,产业债,103977,2025/11/6
中华人民共和国,PBOCIN 2.3 12/22/22,-,2.3,-,5000.00 百万,2022/6/23,--,--,政府债,103980,2022/12/22
宁德时代新能源科技股份有限公司,BCHINA 1.87 09/17/25,-,1.87,-,7.37 百万,2022/6/23,--,--,产业债,103981,2025/9/17
恒基兆业地产有限公司,HENLND 3.8 06/21/24,-,3.8,-,1000.00 百万,2022/6/22,--,--,地产债,103955,2024/6/21
中国信达(香港)控股有限公司,BCHINA 3.81 03/09/24,-,3.81,-,26.89 百万,2022/6/22,--,--,金融债,103968,2024/3/9
齐鲁财金(山东)经济发展有限公司,LWECDI 5.15 05/22/25,-,5.15,-,32.00 百万,2022/6/22,一般公司用途,--,城投债,103972,2025/5/22
江苏云港投资发展有限公司,CHGDHB 1.9 06/21/23,-,1.9,-,33.00 百万,2022/6/22,用于一般企业用途,--,城投债,103973,2023/6/21
丽水经济技术开发区实业发展集团有限公司,LSECTZ 4.5 06/21/25,-,4.5,-,96.50 百万,2022/6/21,项目建设和一般企业用途,--,城投债,103956,2025/6/21
昆明市交通投资有限责任公司,KMCMIN 7 06/22/23,-,7,-,110.00 百万,2022/6/21,为发行人在中国境外发行的债券的未偿余额再融资,--,城投债,103969,2023/6/22
上海银行(香港)有限公司,BOSHAI 2.8 06/20/23,-,2.8,-,300.00 百万,2022/6/21,--,--,金融债,104164,2023/6/20
泰州鑫泰集团有限公司,TZXITA 4.5 06/17/25,-,4.5,-,32.00 百万,2022/6/17,为发行人的现有离岸债务进行再融资,--,城投债,103939,2025/6/17
成都陆港枢纽投资发展集团有限公司,CHGINL 4 06/17/25,-,4,-,100.00 百万,2022/6/17,一般业务用途，运营资本,--,城投债,103943,2025/6/17
天津蓟州新城建设投资有限公司,TJJZCI 3.9 06/17/25,-,3.9,-,70.00 百万,2022/6/17,对发行人于2022年7月到期的中长期债券进行再融资,--,城投债,103954,2025/6/17
陕西省西咸新区泾河新城开发建设(集团)有限公司,XXJHDC 7.2 06/17/25,-,7.2,-,100.00 百万,2022/6/17,再融资,--,城投债,103957,2025/6/17
扬州市江都沿江开发有限公司,YZJNDU 3.2 06/16/23,-,3.2,-,30.00 百万,2022/6/17,--,--,城投债,103960,2023/6/16
中国建设银行股份有限公司,BCHINA 3.92 02/27/24,-,3.92,-,13.47 百万,2022/6/17,--,--,金融债,103964,2024/2/27
中华人民共和国,CGB 2.75 06/17/27,-,2.75,-,2500.00 百万,2022/6/17,--,--,政府债,103965,2027/6/17
中华人民共和国,CGB 2.44 06/17/24,-,2.44,-,6500.00 百万,2022/6/17,--,--,政府债,103966,2024/6/17
中华人民共和国,CGB 2.55 06/17/25,-,2.55,-,2500.00 百万,2022/6/17,--,--,政府债,103967,2025/6/17
凉山州发展(控股)集团有限责任公司,LSHSID 4.5 06/16/25,-,4.5,-,60.00 百万,2022/6/16,--,--,城投债,103940,2025/6/16
中国信达(香港)控股有限公司,BCHINA 4.1 03/09/24,-,4.1,-,1.00 百万,2022/6/16,--,--,金融债,103945,2024/3/9
中国信达(香港)控股有限公司,BCHINA 3.92 03/09/24,-,3.92,-,27.01 百万,2022/6/16,--,--,金融债,103946,2024/3/9
新世界发展有限公司,NWDEVL 5.875 06/16/27,99.064,5.875,6.099,200.00 百万,2022/6/16,根据担保人的可持续融资框架，为符合资格的社会项目提供融资或再融资,2027/3/16,地产债,103917,2027/6/16
新世界发展有限公司,NWDEVL 6.15 PERP,97.34,6.15,7.208,500.00 百万,2022/6/16,为担保人可持续融资条件下的合资格绿色项目进行融资或再融资,2025/3/16至2025/6/16、2025/12/16、2026/6/16、2026/12/16、2027/6/16、2027/12/16、2028/6/16、2028/12/16,地产债,103918,PERP
青岛胶州湾发展集团有限公司,QDJZWD 4.9 06/16/25,97.781,4.9,5.763,300.00 百万,2022/6/16,为发行人于2022年6月到期的中长期债券进行再融资,--,城投债,103919,2025/6/16
连云港港口集团有限公司,LIANYU 5 06/16/25,100.05,5,4.977,250.00 百万,2022/6/16,为该集团现有离岸债务进行再融资。根据本集团的绿色融资框架，发行债券的净收益等额将用于为合格的绿色项目进行融资和/或再融资,--,城投债,103931,2025/6/16
中国银行股份有限公司,BCHINA 3.125 06/16/25,98.712,3.125,3.609,500.00 百万,2022/6/16,为中国银行可持续发展系列债券管理声明中定义的符合条件的绿色项目提供融资和/或再融资,--,金融债,103932,2025/6/16
山东国惠投资控股集团有限公司,BCHINA 4.85 06/15/25,-,4.85,-,4.01 百万,2022/6/15,--,--,城投债,103942,2025/6/15
恒力集团有限公司,KGIINT 0.5 06/12/24,-,0.5,-,50.00 百万,2022/6/15,--,2024/5/31、2024/6/7,产业债,103944,2024/6/12
南京扬子国资投资集团有限责任公司,BCHINA 4.3 06/05/24,-,4.3,-,2.00 百万,2022/6/15,--,--,城投债,103948,2024/6/5
中航国际租赁有限公司,BCHINA 1.75 03/30/24,-,1.75,-,4.00 百万,2022/6/15,--,--,产业债,103949,2024/3/30
中国国际金融(国际)有限公司,BCHINA 1.8 08/10/23,-,1.8,-,6.68 百万,2022/6/15,--,--,金融债,103950,2023/8/10
中国银行(香港)有限公司,BCHINA 5.93 09/14/23,-,5.93,-,20.05 百万,2022/6/15,--,--,金融债,103952,2023/9/14
中信建投证券股份有限公司,BCHINA 1.2 06/10/24,-,1.2,-,20.05 百万,2022/6/15,--,--,金融债,103953,2024/6/10
山东国惠投资控股集团有限公司,SHGUOH 4.7 06/15/25,97.814,4.7,5.548,500.00 百万,2022/6/15,用于偿还担保人及其子公司的离岸债务,--,城投债,103920,2025/6/15
山东高速集团有限公司,CNSHAN 4.1 06/15/25,99.052,4.1,4.461,500.00 百万,2022/6/15,根据担保人的绿色金融框架，全部或部分用于绿色项目融资和/或再融资,--,城投债,103933,2025/6/15
中银航空租赁有限公司,BCHINA 4.08 01/25/24,-,4.08,-,13.34 百万,2022/6/14,--,--,金融债,103941,2024/1/25
水发集团有限公司,BCHINA 4 03/24/24,-,4,-,116.00 百万,2022/6/14,--,--,城投债,103947,2024/3/24
陕西金融资产管理股份有限公司,BCHINA 3.2 03/18/24,-,3.2,-,64.00 百万,2022/6/14,--,--,金融债,103951,2024/3/18
长春市城市发展投资控股(集团)有限公司,CCUDIH 5 06/14/25,96.375,5,6.43,200.00 百万,2022/6/14,根据绿色金融框架和发改委证明，为一年内到期的中长期离岸债务进行再融资,--,城投债,103915,2025/6/14
舟山群岛新区蓬莱国有资产投资集团有限公司,ZHSIPL 3.9 06/14/25,-,3.9,-,150.00 百万,2022/6/14,为项目进行融资以及补充运营资本,--,城投债,103916,2025/6/14
中银航空租赁有限公司,BCHINA 2.78 01/17/25,-,2.78,-,20.08 百万,2022/6/13,--,--,金融债,103936,2025/1/17
交通银行股份有限公司,BCHINA 3.95 11/18/25,-,3.95,-,33.47 百万,2022/6/13,--,--,金融债,103937,2025/11/18
中国工商银行股份有限公司,BCHINA 3.29 09/24/26,-,3.29,-,20.08 百万,2022/6/13,--,--,金融债,103938,2026/9/24
中国建设银行股份有限公司,CCB 2.85 06/13/24,-,2.85,-,350.00 百万,2022/6/13,为发行人融资，用于一般公司用途,--,金融债,103910,2024/6/13
招银国际租赁管理有限公司,CMINLE Float 06/12/23,-,O/N SOFR+95,-,120.00 百万,2022/6/13,--,--,金融债,103912,2023/6/12
新疆交通建设投资控股有限公司,XJJJTZ 5.8 06/13/25,-,5.8,-,70.00 百万,2022/6/13,根据国家发展和改革委员会(NDRC)的注册证书，对一年内到期的中长期离岸债券的本金进行再融资,--,城投债,103928,2025/6/13
中国建设银行股份有限公司,BCHINA 2.59 06/24/25,-,2.59,-,13.39 百万,2022/6/13,--,--,金融债,103934,2025/6/24
工银国际租赁财务有限公司,BCHINA 1.88 08/25/25,-,1.88,-,20.08 百万,2022/6/13,--,--,金融债,103935,2025/8/25
华泰国际金融控股有限公司,HTIFIH 2.86 06/08/23,-,2.86,-,100.00 百万,2022/6/10,--,--,金融债,103904,2023/6/8
中银航空租赁有限公司,BCHINA 3.41 04/29/25,-,3.41,-,13.34 百万,2022/6/10,--,--,产业债,103922,2025/4/29
中国信达(香港)控股有限公司,BCHINA 4.42 04/23/25,-,4.42,-,20.01 百万,2022/6/10,--,--,金融债,103923,2025/4/23
中国建设银行股份有限公司,BCHINA 2.61 06/24/25,-,2.61,-,46.69 百万,2022/6/10,--,--,金融债,103924,2025/6/24
中国工商银行股份有限公司,BCHINA 3.26 09/24/26,-,3.26,-,20.01 百万,2022/6/10,--,--,金融债,103925,2026/9/24
交通银行(香港)有限公司,BCHINA 3.87 03/03/25,-,3.87,-,26.68 百万,2022/6/10,--,--,金融债,103926,2025/3/3
国银金融租赁股份有限公司,BCHINA 3.02 09/28/25,-,3.02,-,46.69 百万,2022/6/10,--,--,金融债,103927,2025/9/28
香港机场管理局,HKAA 2.6 06/07/24,-,2.6,-,500.00 百万,2022/6/9,--,--,产业债,103879,2024/6/7
泰州鑫泰集团有限公司,TZXITA 3.85 06/09/25,-,3.85,-,48.00 百万,2022/6/9,为发行人的现有离岸债务进行再融资,--,城投债,103899,2025/6/9
海通国际证券集团有限公司,HTISEC 2 01/10/23,-,2,-,100.00 百万,2022/6/9,--,--,金融债,103900,2023/1/10
信银(香港)投资有限公司,CNCBHK 2.9496 06/08/23,-,2.9496,-,200.00 百万,2022/6/9,--,--,金融债,103903,2023/6/8
青岛市即墨区城市旅游开发投资有限公司,JIMOTM 4.5 06/09/25,-,4.5,-,110.00 百万,2022/6/9,为开发集团项目进行融资，并补充集团的营运资本,--,城投债,103909,2025/6/9
南京溧水经济技术开发集团有限公司,LSETID 3.8 06/09/25,-,3.8,-,62.00 百万,2022/6/9,偿还发行人的债务,--,城投债,103911,2025/6/9
中国工商银行股份有限公司,BCHINA 3.3 09/24/26,-,3.3,-,19.95 百万,2022/6/9,--,2022/6/9,金融债,103913,2026/9/24
济南城市建设集团有限公司,JNUCGC 3.8 06/09/25,-,3.8,-,600.00 百万,2022/6/9,运营资本，项目融资,--,城投债,103921,2025/6/9
香港机场管理局,HKAA 2.6 06/08/24,-,2.6,-,500.00 百万,2022/6/8,--,--,产业债,103873,2024/6/8
合肥市产业投资控股(集团)有限公司,HEFIND 3.9 06/08/25,99.962,3.9,3.912,500.00 百万,2022/6/8,项目建设和设备采购,--,城投债,103891,2025/6/8
湖州吴兴国有资本投资发展有限公司,HZWXSC 5.45 06/08/25,-,5.45,-,105.00 百万,2022/6/8,项目融资以及一般企业用途,--,城投债,103892,2025/6/8
海通国际证券集团有限公司,HTISEC 2.1 01/09/23,-,2.1,-,1700.00 百万,2022/6/8,--,--,金融债,103894,2023/1/9
万科企业股份有限公司,VNKRLE 3.55 06/08/25,-,3.55,-,510.00 百万,2022/6/8,一般业务用途，再融资,--,地产债,103901,2025/6/8
英利国际置业股份有限公司,YINGLI 4 05/31/23,-,4,-,56.00 百万,2022/6/8,再融资,--,地产债,103907,2023/5/31
江苏姜堰经开集团有限公司,TZJYJK 3.9 06/07/25,-,3.9,-,90.00 百万,2022/6/7,用于项目建设和一般运营资金,--,城投债,103881,2025/6/7
江苏姜堰经开集团有限公司,TZJYJK 3.9 06/07/25,-,3.9,-,48.00 百万,2022/6/7,用于项目建设和补充运营资金,--,城投债,103882,2025/6/7
江苏姜堰经开集团有限公司,TZJYJK 3.9 06/07/25,-,3.9,-,27.00 百万,2022/6/7,用于项目建设和一般运营资金,--,城投债,103883,2025/6/7
太原国有投资集团有限公司,TYSTOW 4.55 06/07/25,103.554,4.55,3.203,200.00 百万,2022/6/7,用于偿还离岸债务,--,城投债,103885,2025/6/7
江苏射阳大米集团有限公司,SYRICE 1.7 06/06/23,-,1.7,-,37.50 百万,2022/6/7,一般业务用途,--,城投债,103896,2023/6/6
成都湔江投资集团有限公司,PZSOAO 4.5 06/07/25,-,4.5,-,100.00 百万,2022/6/7,运营资本，项目融资,--,城投债,103897,2025/6/7
武汉市江夏农业集团有限公司,JXWHAG 2.3 05/07/25,-,2.3,-,93.00 百万,2022/6/7,再融资,--,城投债,103898,2025/5/7
香港机场管理局,HKAA 2.8 06/06/24,-,2.8,-,1000.00 百万,2022/6/6,--,--,产业债,103864,2024/6/6
香港机场管理局,HKAA 2.8 06/06/24,-,2.8,-,1000.00 百万,2022/6/6,--,--,产业债,103875,2024/6/6
新湖中宝股份有限公司,XINHUZ 11 06/06/25,100,11,10.984,150.00 百万,2022/6/6,--,2024/6/6,地产债,103895,2025/6/6
江苏中南建设集团股份有限公司,JIAZHO 12 06/05/23,-,12,-,157.01 百万,2022/6/6,--,2022/6/6,地产债,103908,2023/6/5
香港机场管理局,HKAA 2.8 06/03/24,-,2.8,-,500.00 百万,2022/6/2,--,--,产业债,103866,2024/6/3
新城发展控股有限公司,FTLNHD 7.95 06/01/23,80.5,7.95,39.628,100.00 百万,2022/6/2,对现有的将在一年内到期的中长期离岸债务进行再融资，并仅适用于符合担保人可持续融资框架的合格绿色项目,--,地产债,103887,2023/6/1
中国工商银行股份有限公司,ICBCAS Float 06/01/25,100.059,SOFR+75,-,600.00 百万,2022/6/1,如工商银行绿色债券框架所定义，发行人将使用相当于净收益的金额为符合条件的绿色资产融资和/或再融资,--,金融债,103858,2025/6/1
中国工商银行股份有限公司,ICBCAS 1.625 06/01/25,-,1.625,-,300.00 百万,2022/6/1,将使用与净收入等额的资金，为符合中国工商银行绿色债券框架下规定的合格绿色资产进行融资和/或再融资,--,金融债,103859,2025/6/1
中国工商银行股份有限公司,ICBCAS 3.2 06/01/24,-,3.2,-,2000.00 百万,2022/6/1,根据工商银行绿色债券框架，为符合条件的绿色资产提供融资和/或再融资,--,金融债,103860,2024/6/1
中国工商银行股份有限公司,ICBCAS 2.95 06/01/24,-,2.95,-,2000.00 百万,2022/6/1,将使用与净收入等额的资金，为符合中国工商银行绿色债券框架下规定的合格绿色资产进行融资和/或再融资,--,金融债,103862,2024/6/1
中国工商银行股份有限公司,ICBCAS 2.95 06/01/25,98.207,2.95,3.635,1200.00 百万,2022/6/1,根据工商银行绿色债券框架，为符合条件的绿色资产提供融资和/或再融资,--,金融债,103863,2025/6/1
招商局港口控股有限公司,CMHI 4 06/01/27,99.607,4,4.09,500.00 百万,2022/6/1,用于集团的一般企业用途，包括偿还现有债务,2027/5/1,产业债,103869,2027/6/1
咸宁城市发展(集团)有限责任公司,XIURDE 4.5 06/01/25,97.505,4.5,5.48,70.50 百万,2022/6/1,补充运营资本,--,城投债,103870,2025/6/1
无锡金源产业投资发展集团有限公司,WXJYID 2.4 06/01/25,-,2.4,-,139.00 百万,2022/6/1,用于无锡滨湖区智能制造产业园B区项目，该项目为发行人绿色债券框架下的合格绿色项目，并补充运营资金,--,城投债,103871,2025/6/1
牡丹江市城市投资集团有限公司,MDJINV 8 06/01/25,-,8,-,100.00 百万,2022/6/1,为现有离岸债务进行再融资,--,城投债,103874,2025/6/1
漳州市交通发展集团有限公司,ZZTRAN 4.98 06/01/25,100.33,4.98,4.848,500.00 百万,2022/6/1,根据发改委认证和绿色金融框架，对离岸债务进行再融资,--,城投债,103876,2025/6/1
山东明水国开实业开发有限公司,SDMSGK 2.2 06/01/25,-,2.2,-,11.00 百万,2022/6/1,为集团的中意科技产业城一期项目和生命健康科技园项目提供资金和补充运营资本,--,城投债,103880,2025/6/1
陕西金融资产管理股份有限公司,BCHINA 3.2 03/18/24,-,3.2,-,6.00 百万,2022/6/1,--,--,金融债,103888,2024/3/18
大唐集团控股有限公司,DTGRHD 12.5 05/31/23,-,12.5,-,283.95 百万,2022/6/1,交换要约,2022/6/1,地产债,103906,2023/5/31
九龙仓置业地产投资有限公司,WREICL 3 05/31/24,-,3,-,200.00 百万,2022/5/31,--,--,地产债,103856,2024/5/31
重庆市合川城市建设投资(集团)有限公司,CHOHEC 6 05/31/25,99.75,6,6.095,233.00 百万,2022/5/31,用于偿还集团现有债务及一般公司用途,--,城投债,103861,2025/5/31
海通证券股份有限公司,HAITIB 4 05/29/27,-,4,-,150.00 百万,2022/5/31,为现有债务进行再融资,--,金融债,103868,2027/5/29
武汉地铁集团有限公司,BCHINA 2.96 09/24/24,-,2.96,-,6.00 百万,2022/5/31,--,--,城投债,103878,2024/9/24
遵义道桥建设(集团)有限公司,ZYRDBG 7.2 05/31/25,-,7.2,-,165.00 百万,2022/5/31,再融资,--,城投债,103884,2025/5/31
交通银行股份有限公司,BOCOM 3 05/31/25,-,3,-,2000.00 百万,2022/5/31,--,--,金融债,104143,2025/5/31
交通银行股份有限公司,BOCOM 3.2 05/31/24,-,3.2,-,1000.00 百万,2022/5/31,--,--,金融债,104153,2024/5/31
九龙仓置业地产投资有限公司,WREICL 3.4 05/27/25,-,3.4,-,300.00 百万,2022/5/27,--,--,地产债,103835,2025/5/27
华泰国际金融控股有限公司,HTIFIH 2.85 05/25/23,-,2.85,-,50.00 百万,2022/5/27,--,--,金融债,103840,2023/5/25
天台县国有资本运营有限公司,TTSOAM 2.4 05/27/25,-,2.4,-,63.00 百万,2022/5/27,项目开发和补充营运资金,--,城投债,103845,2025/5/27
天台县国有资本运营有限公司,TTSOAM 2.4 05/27/25,-,2.4,-,90.00 百万,2022/5/27,项目开发及补充运营资本,--,城投债,103846,2025/5/27
无锡市城开实业发展集团有限公司,WXCKIN 2.3 05/27/25,-,2.3,-,40.00 百万,2022/5/27,项目建设和补充运营资本,--,城投债,103851,2025/5/27
中融国际控股有限公司,ZHNBND 6.8 05/26/23,-,6.8,-,190.00 百万,2022/5/27,一般公司用途和偿还现有债务,--,金融债,103857,2023/5/26
交通银行股份有限公司,BOCOM 3 05/27/24,-,3,-,1000.00 百万,2022/5/27,--,--,金融债,104119,2024/5/27
中华人民共和国(香港特区政府),GBHK 3.3 05/26/42,-,3.3,-,500.00 百万,2022/5/26,--,--,政府债,103823,2042/5/26
香港中华煤气有限公司,HKCGAS 3.2 05/26/25,-,3.2,-,300.00 百万,2022/5/26,资本支出、一般企业用途、再融资,--,产业债,103829,2025/5/26
中国银行股份有限公司,BCHINA 3 05/22/24,-,3,-,200.00 百万,2022/5/26,--,--,金融债,103839,2024/5/22
香港机场管理局,HKAA 2.8 05/26/24,-,2.8,-,1500.00 百万,2022/5/26,--,--,产业债,103848,2024/5/26
中国工商银行股份有限公司,ICBCAS Float 05/26/25,-,3m NFIXF+110,-,175.00 百万,2022/5/26,一般业务用途,--,金融债,103867,2025/5/26
无锡恒廷实业有限公司,SIHAII 3.8 05/25/25,-,3.8,-,130.00 百万,2022/5/25,在岸汇款用于发展租赁业务和项目的投资与建设,--,城投债,103833,2025/5/25
恒基兆业地产有限公司,HENLND 3.25 05/25/24,-,3.25,-,55.00 百万,2022/5/25,--,--,地产债,103834,2024/5/25
湖州南浔新城投资发展集团有限公司,NXNTID 3.9 05/25/25,-,3.9,-,40.00 百万,2022/5/25,--,--,城投债,103847,2025/5/25
中华人民共和国,PBOCIN 2.8 05/25/23,-,2.8,-,15000.00 百万,2022/5/25,--,--,政府债,103854,2023/5/25
中华人民共和国,PBOCIN 2.49 08/24/22,-,2.49,-,10000.00 百万,2022/5/25,--,--,政府债,103855,2022/8/24
中国农业银行股份有限公司,AGRBK 2.84 11/25/22,-,2.84,-,2000.00 百万,2022/5/25,--,--,金融债,104134,2022/11/25
九龙仓置业地产投资有限公司,WREICL 3.1 05/24/24,-,3.1,-,300.00 百万,2022/5/24,--,--,地产债,103822,2024/5/24
山东黄金集团有限公司,SDGOLD 4.95 PERP,-,4.95,-,100.00 百万,2022/5/24,为集团成员的若干债务再融资及一般公司用途,2025/5/24、2025/11/24、2026/5/24、2026/11/24、2027/5/24、2027/11/24、2028/5/24、2028/11/24、2029/5/24,产业债,103837,PERP
中航国际租赁有限公司,AVIILC 4.05 05/24/25,98.611,4.05,4.591,450.00 百万,2022/5/24,用于债务置换,--,产业债,103841,2025/5/24
华泰国际金融控股有限公司,HFHHK 0 09/30/26,-,0,-,35.11 百万,2022/5/24,--,--,金融债,103850,2026/9/30
中银航空租赁有限公司,BOCAVI 4.334 05/24/27,98.785,4.334,4.62,300.00 百万,2022/5/24,资本支出、一般业务用途、再融资,2027/4/24,产业债,103852,2027/5/24
中国建设银行股份有限公司,CCB 2.9 05/23/23,-,2.9,-,500.00 百万,2022/5/24,--,--,金融债,104162,2023/5/23
中华人民共和国(香港特区政府),HKGB 2.35 05/23/24,-,2.35,-,1200.00 百万,2022/5/23,--,--,政府债,103817,2024/5/23
中国银行股份有限公司,BCHINA 2.8 02/23/23,-,2.8,-,1000.00 百万,2022/5/23,--,--,金融债,104191,2023/2/23
台州市黄岩交通旅游投资集团有限公司,THTTIG 2.4 05/20/25,-,2.4,-,65.00 百万,2022/5/20,用于建设项目和补充一般营运资金,--,城投债,103818,2025/5/20
台州市黄岩交通旅游投资集团有限公司,THTTIG 2.4 05/20/25,-,2.4,-,75.00 百万,2022/5/20,运营资本、项目融资,--,城投债,103819,2025/5/20
成都天府大港集团有限公司,CDTFDG 4.5 05/19/25,-,4.5,-,100.00 百万,2022/5/19,运营资本，项目融资,--,城投债,103821,2025/5/19
兴业银行股份有限公司,INDUBK 3.25 05/18/25,98.946,3.25,3.657,650.00 百万,2022/5/18,为兴业银行绿色债券框架下符合“可再生能源”定义的风能和太阳能发电项目相关的合格的绿色资产和“低碳和低排放运输”类别下的电气化铁路和地铁项目提供融资和/或再融资,--,金融债,103811,2025/5/18
中梁控股集团有限公司,ZHLGHD 8.75 04/15/23,19.125,8.75,558.171,224.22 百万,2022/5/18,对ZHLGHD 8.5 05/19/22进行交换要约,2022/5/18,地产债,103824,2023/4/15
中梁控股集团有限公司,ZHLGHD 9.75 12/31/23,22.25,9.75,174.791,473.84 百万,2022/5/18,对ZHLGHD 9.5 07/29/22进行交换要约,2022/5/18,地产债,103825,2023/12/31
中华人民共和国(香港特区政府),GBHK Float 05/18/23,-,O/N HONIA FLAT,-,1500.00 百万,2022/5/18,--,--,政府债,103828,2023/5/18
长沙金霞新城城市发展有限公司,CSJXDC 4.1 05/17/25,-,4.1,-,145.00 百万,2022/5/17,项目投资、再融资和补充运营资本,--,城投债,103802,2025/5/17
中国建设银行股份有限公司,CCB 3.4 05/17/24,-,3.4,-,1000.00 百万,2022/5/17,向参与符合条件的绿色项目的客户提供全部或部分贷款以及该行自身符合条件绿色项目提供全部或部分融资和/或再融资,--,金融债,103803,2024/5/17
中国建设银行股份有限公司,CCB 3.125 05/17/25,98.596,3.125,3.669,1000.00 百万,2022/5/17,向参与符合条件的绿色项目的客户提供全部或部分贷款以及该行自身符合条件绿色项目提供全部或部分融资和/或再融资,--,金融债,103804,2025/5/17
新奥能源控股有限公司,XINAOG 4.625 05/17/27,100.938,4.625,4.398,550.00 百万,2022/5/17,为集团的若干现有债务再融资和/或对资本和营运支出再融资,2027/4/17,产业债,103809,2027/5/17
新奥能源控股有限公司,XINAOG 4.625 05/17/27,100.938,4.625,4.398,550.00 百万,2022/5/17,为集团的若干现有债务再融资和/或对资本和营运支出再融资,2027/4/17,产业债,103810,2027/5/17
东方证券股份有限公司,ORSECH 3.5 05/17/25,98.246,3.5,4.185,300.00 百万,2022/5/17,为集团现有离岸债务再融资,--,金融债,103812,2025/5/17
三亚崖州湾科技城开发建设有限公司,SANYZH 2 04/17/23,-,2,-,66.00 百万,2022/5/17,一般业务用途,--,城投债,103816,2023/4/17
华泰国际金融控股有限公司,HFHHK 0 07/07/26,-,0,-,20.00 百万,2022/5/17,--,--,金融债,103820,2026/7/7
中国农业银行股份有限公司,AGRBK 3.1 05/15/23,-,3.1,-,1190.00 百万,2022/5/16,--,--,金融债,104139,2023/5/15
上海浦东发展银行股份有限公司,SHANPU 3.1 05/12/23,-,3.1,-,1200.00 百万,2022/5/13,--,--,金融债,104197,2023/5/12
中国农业银行股份有限公司,AGRBK 3.4 05/12/23,-,3.4,-,300.00 百万,2022/5/13,--,--,金融债,104145,2023/5/12
上海银行(香港)有限公司,BOSHAI 3.4 05/08/23,-,3.4,-,400.00 百万,2022/5/13,--,--,金融债,104147,2023/5/8
中国工商银行股份有限公司,BCHINA 3.2 09/24/26,-,3.2,-,14.00 百万,2022/5/12,--,--,金融债,103801,2026/9/24
中国银行股份有限公司,CCAMCL 3.6 03/04/25,-,3.6,-,4.00 百万,2022/5/12,--,--,金融债,103805,2025/3/4
上海浦东发展银行股份有限公司,SHANPU 3.2 05/11/23,-,3.2,-,1000.00 百万,2022/5/12,--,--,金融债,104124,2023/5/11
湖州吴兴产业投资发展集团有限公司,WUXING 4 05/11/25,-,4,-,150.00 百万,2022/5/11,运营资本，项目融资,--,城投债,103785,2025/5/11
腾讯控股有限公司,BCHINA 3.8 02/11/25,-,3.8,-,6.00 百万,2022/5/11,--,--,产业债,103797,2025/2/11
阿里巴巴集团控股有限公司,BCHINA 3.6 11/28/24,-,3.6,-,6.00 百万,2022/5/11,--,--,产业债,103798,2024/11/28
中国银行股份有限公司,BCHINA 5 11/13/24,-,5,-,10.00 百万,2022/5/11,--,--,金融债,103799,2024/11/13
交通银行(香港)有限公司,BCHINA 3.725 03/03/25,-,3.725,-,10.00 百万,2022/5/11,--,--,金融债,103800,2025/3/3
中国交通建设股份有限公司,BCHINA 3.425 11/21/24,-,3.425,-,24.00 百万,2022/5/10,--,--,产业债,103793,2024/11/21
中国冶金科工股份有限公司,BCHINA 2.95 04/20/24,-,2.95,-,10.80 百万,2022/5/10,--,--,产业债,103794,2024/4/20
招银国际租赁管理有限公司,CMINLE Float 05/05/23,-,O/N SOFR+85,-,45.00 百万,2022/5/6,--,--,金融债,103774,2023/5/5
招银国际租赁管理有限公司,CMINLE Float 05/05/23,-,O/N SOFR+100,-,75.00 百万,2022/5/6,--,--,金融债,103778,2023/5/5
重庆市南岸区城市建设发展(集团)有限公司,CQNANA 4.98 05/06/25,98.914,4.98,5.414,300.00 百万,2022/5/6,为本集团2022年6月到期的离岸债券进行再融资,--,城投债,103782,2025/5/6
扬州园博投资发展有限公司,YZYBIV 3.8 04/06/25,-,3.8,-,36.00 百万,2022/5/6,用于偿还现有的离岸短期债券,--,城投债,103784,2025/4/6
中国进出口银行,EXIMCH 2.7 05/06/24,-,2.7,-,250.00 百万,2022/5/6,--,--,金融债,103786,2024/5/6
中国建设银行股份有限公司,CCB 3.2 05/05/23,-,3.2,-,325.00 百万,2022/5/6,--,--,金融债,104128,2023/5/5
中国建设银行股份有限公司,CCB 3.35 05/05/23,-,3.35,-,300.00 百万,2022/5/6,--,--,金融债,104136,2023/5/5
东方证券股份有限公司,ORSECH 1.75 05/05/25,-,1.75,-,100.00 百万,2022/5/5,为集团的现有离岸债务再融资,--,金融债,103776,2025/5/5
华泰国际金融控股有限公司,HTIFIH 1.75 11/04/22,-,1.75,-,50.00 百万,2022/5/5,一般企业用途,--,金融债,103779,2022/11/4
国银租赁(国际)有限公司,CDBLFD Float 05/08/23,-,O/N SOFR+85,-,100.00 百万,2022/5/5,--,--,金融债,103780,2023/5/8
中国进出口银行,EXIMCH 2.7 05/05/24,-,2.7,-,100.00 百万,2022/5/5,--,--,金融债,103783,2024/5/5
中国光大银行股份有限公司,CHEVBK 3.35 02/06/23,-,3.35,-,500.00 百万,2022/5/5,--,--,金融债,104113,2023/2/6
华泰国际金融控股有限公司,HTIFIH 1.25 08/04/22,-,1.25,-,60.00 百万,2022/5/4,运营资本,--,金融债,103787,2022/8/4
中国建设银行股份有限公司,CCB 3.25 05/03/23,-,3.25,-,200.00 百万,2022/5/4,--,--,金融债,104142,2023/5/3
交通银行股份有限公司,BOCOM 3.2 04/28/23,-,3.2,-,300.00 百万,2022/4/29,--,--,金融债,104192,2023/4/28
中国进出口银行,EXIMCH 2.7 04/29/24,-,2.7,-,200.00 百万,2022/4/29,--,--,金融债,103758,2024/4/29
成都湔江投资集团有限公司,PZSOAO 4.2 04/29/25,-,4.2,-,70.00 百万,2022/4/29,运营资本,--,城投债,103770,2025/4/29
兰溪市交通建设投资集团有限公司,LATRCO 3.9 04/29/25,-,3.9,-,100.00 百万,2022/4/29,项目建设和补充运营资本,--,城投债,103775,2025/4/29
西安哄狈⒄辜团有限公司,CHBAHE 4.2 04/29/25,-,4.2,-,60.00 百万,2022/4/29,补充运营资本,--,城投债,103777,2025/4/29
国家开发银行,SDBC 2.75 04/29/24,98.925,2.75,3.414,300.00 百万,2022/4/29,--,--,金融债,103814,2024/4/29
中国建设银行股份有限公司,CCB 3.23 04/28/23,-,3.23,-,700.00 百万,2022/4/29,--,--,金融债,104126,2023/4/28
中国建设银行股份有限公司,CCB 3.2 04/28/23,-,3.2,-,600.00 百万,2022/4/29,--,--,金融债,104173,2023/4/28
中国银行股份有限公司,BCHINA 1.5 04/28/25,-,1.5,-,500.00 百万,2022/4/28,为中国银行可持续发展系列债券管理声明中定义的符合条件的绿色项目提供融资和/或再融资,--,金融债,103759,2025/4/28
中国长城资产(国际)控股有限公司,GRWALL 4.25 04/28/25,92.899,4.25,7.212,500.00 百万,2022/4/28,再融资,--,金融债,103760,2025/4/28
南洋商业银行有限公司,NANYAN 6.5 PERP,97.773,6.5,-,650.00 百万,2022/4/28,根据银行业(资本)规则补充额外的一级资本,2027/4/28、2027/10/28、2028/4/28、2028/10/28、2029/4/28、2029/10/28、2030/4/28、2030/10/28、2031/4/28,金融债,103762,PERP
中国银行股份有限公司,BCHINA Float 04/28/25,99.965,SOFR+78,-,1000.00 百万,2022/4/28,为中国银行可持续发展系列债券管理声明中定义的符合条件的绿色项目提供融资和/或再融资,--,金融债,103763,2025/4/28
中国银行股份有限公司,BCHINA 3.25 04/28/25,98.97,3.25,3.656,500.00 百万,2022/4/28,为中国银行可持续发展系列债券管理声明中定义的符合条件的绿色项目提供融资和/或再融资,--,金融债,103764,2025/4/28
成都空港兴城投资集团有限公司,SLSCCI 4.5 04/28/25,99.609,4.5,4.654,500.00 百万,2022/4/28,为离岸债券进行再融资,--,城投债,103771,2025/4/28
淮安开发控股有限公司,HUAHK 5 04/28/25,-,5,-,300.00 百万,2022/4/28,为偿还集团的离岸债务,--,城投债,103772,2025/4/28
交通银行股份有限公司,BOCOM 3 04/27/23,-,3,-,500.00 百万,2022/4/28,--,--,金融债,104133,2023/4/27
中国农业银行股份有限公司,AGRBK 2.9 10/28/22,-,2.9,-,650.00 百万,2022/4/28,--,--,金融债,104140,2022/10/28
恒基兆业地产有限公司,HENLND 3.45 04/27/24,-,3.45,-,150.00 百万,2022/4/27,公司间贷款,--,地产债,103748,2024/4/27
济南能源集团有限公司,GUOENV 3 04/26/23,-,3,-,100.00 百万,2022/4/27,出资、股权投资、偿还负债、固定资产投资和其他一般公司用途,--,城投债,103756,2023/4/26
常德市经济建设投资集团有限公司,CHAECO 5 04/26/23,-,5,-,60.00 百万,2022/4/27,再融资,--,城投债,103766,2023/4/26
江苏瀚瑞投资控股有限公司,HRINT 3.8 04/27/25,-,3.8,-,44.00 百万,2022/4/27,再融资,--,城投债,103767,2025/4/27
江苏瀚瑞投资控股有限公司,HRINT 3.8 04/27/25,-,3.8,-,120.00 百万,2022/4/27,再融资,--,城投债,103768,2025/4/27
海通恒信国际融资租赁股份有限公司,UNFILE 4.2 04/27/25,-,4.2,-,200.00 百万,2022/4/27,一般业务用途、营运资本、再融资,--,金融债,103769,2025/4/27
扬州龙川控股集团有限责任公司,LCOSIV 3.8 04/26/23,-,3.8,-,101.00 百万,2022/4/27,偿还现有债务，补充运营资本和一般公司用途,--,城投债,103773,2023/4/26
中国建设银行股份有限公司,CCB 3.2 04/26/23,-,3.2,-,150.00 百万,2022/4/27,--,--,金融债,104168,2023/4/26
九龙仓置业地产投资有限公司,WREICL 3.5 04/26/25,-,3.5,-,40.00 百万,2022/4/26,--,--,地产债,103731,2025/4/26
港华智慧能源有限公司,PANVA 4 04/26/27,97.123,4,4.691,200.00 百万,2022/4/26,发行债券的净收益将由发行人或担保人使用(1)对集团现有债务进行再融资;(2)用于本集团的资本支出;(3)用于一般公司用途,--,产业债,103742,2027/4/26
中国进出口银行,EXIMCH 1 04/26/25,-,1,-,300.00 百万,2022/4/26,--,--,金融债,103747,2025/4/26
远洋集团控股有限公司,SINOCE 3.8 04/26/25,101.05,3.8,3.384,200.00 百万,2022/4/26,根据担保人的绿色投资框架，偿还担保人及其子公司现有的在一年内到期的中长期外债,2025/3/26,地产债,103757,2025/4/26
岳阳市城市建设投资集团有限公司,YYCCIG 4.6 04/26/25,98.687,4.6,5.129,220.00 百万,2022/4/26,用于岳阳临港高新技术产业开发区创新创业基地二期项目基础设施建设，补充集团营运资金,--,城投债,103761,2025/4/26
江苏瀚瑞投资控股有限公司,HRINT 4.5 04/26/25,-,4.5,-,84.00 百万,2022/4/26,再融资,--,城投债,103765,2025/4/26
嵊州市交通投资发展集团有限公司,SZTFDV 3.5 04/25/25,-,3.5,-,142.00 百万,2022/4/25,项目建设，补充营运资金,--,城投债,103743,2025/4/25
中国进出口银行,EXIMCH 1 04/25/25,-,1,-,100.00 百万,2022/4/25,--,--,金融债,103749,2025/4/25
中国进出口银行,EXIMCH 2.8 04/25/25,-,2.8,-,100.00 百万,2022/4/25,--,--,金融债,103750,2025/4/25
泰兴市襟江投资有限公司,TXJJIN 3.5 03/22/25,-,3.5,-,30.00 百万,2022/4/22,为发行人的项目建设筹资和补充运营资本,--,城投债,103732,2025/3/22
东亚银行有限公司,BNKEA 4.875 04/22/32,95.104,4.875,-,500.00 百万,2022/4/22,一般企业用途,2027/4/22,金融债,103734,2032/4/22
中信银行(国际)有限公司,CINDBK 4.8 PERP,96.952,4.8,-,600.00 百万,2022/4/22,融资和一般公司用途,2027/4/22、2027/10/22、2028/4/22、2028/10/22、2029/4/22、2029/10/22、2030/4/22、2030/10/22、2031/4/22,金融债,103740,PERP
凉山州发展(控股)集团有限责任公司,LSHSID 6.5 04/22/25,-,6.5,-,204.00 百万,2022/4/22,偿还现有离岸债务,--,城投债,103744,2025/4/22
中国建设银行股份有限公司,CCB 3.1 04/21/23,-,3.1,-,300.00 百万,2022/4/22,--,--,金融债,104112,2023/4/21
中国建设银行股份有限公司,CCB 3.05 04/21/23,-,3.05,-,500.00 百万,2022/4/22,--,--,金融债,104146,2023/4/21
中国建设银行股份有限公司,CCB 3.15 04/21/23,-,3.15,-,300.00 百万,2022/4/22,--,--,金融债,104150,2023/4/21
中国建设银行股份有限公司,CCB 3.15 04/21/23,-,3.15,-,300.00 百万,2022/4/22,--,--,金融债,104185,2023/4/21
中信证券国际有限公司,CSILTD 3.375 04/21/25,97.588,3.375,4.344,300.00 百万,2022/4/21,作为运营资本和一般公司用途，或为现有债务进行再融资,2025/3/21,金融债,103730,2025/4/21
云南省能源投资集团有限公司,YNPOWE 5.3 04/21/25,97.875,5.3,6.176,230.00 百万,2022/4/21,对现有离岸债务再融资，该债务与可持续融资框架下定义的合格绿色项目的融资和/或再融资有关,--,城投债,103741,2025/4/21
象山县滨海投资有限公司,XSBHIN 4.49 04/21/25,-,4.49,-,50.00 百万,2022/4/21,为若干项目融资和补充集团运营资本,--,城投债,103746,2025/4/21
九龙仓置业地产投资有限公司,WREICL 2.85 04/20/24,-,2.85,-,400.00 百万,2022/4/20,--,--,地产债,103721,2024/4/20
义乌市国有资本运营有限公司,YWSOAO 4.1 10/20/25,97.56,4.1,4.943,500.00 百万,2022/4/20,为现有债务进行再融资,--,城投债,103729,2025/10/20
天津泰达股份有限公司,TJTEDA 4.5 04/19/23,-,4.5,-,50.00 百万,2022/4/20,发行人及其子公司的现有银行贷款再融资,--,城投债,103733,2023/4/19
济南城市建设集团有限公司,JNUCGC 3.8 04/19/25,-,3.8,-,600.00 百万,2022/4/19,运营资本、项目融资,--,城投债,103745,2025/4/19
中华人民共和国(香港特区政府),GBHK 1.79 04/14/25,-,1.79,-,4000.00 百万,2022/4/14,--,--,政府债,103712,2025/4/14
西安城市基础设施建设投资集团有限公司,XANCON 3.5 04/14/25,97.533,3.5,4.501,200.00 百万,2022/4/14,净收益将用于偿还现有债务,--,城投债,103717,2025/4/14
扬州经济技术开发区开发(集团)有限公司,YANGZH 4 04/14/25,98.093,4,4.776,300.00 百万,2022/4/14,根据绿色金融框架和国家发改委证书对现有债务进行再融资,--,城投债,103718,2025/4/14
赣州发展投资控股集团有限责任公司,GANZHO 4.5 04/14/25,98.748,4.5,5.01,300.00 百万,2022/4/14,用于项目投资以及补充营运资金,--,城投债,103719,2025/4/14
中国电力建设集团有限公司,CHPWCN 4.25 PERP,97.574,4.25,4.839,500.00 百万,2022/4/14,偿还集团离岸债务,2027/1/14至2027/4/13每日;2027/10/13、2028/4/13、2028/10/13、2029/4/13、2029/10/13、2030/4/13、2030/10/13,产业债,103720,PERP
江苏皋开投资发展集团有限公司,JSGKID 3.5 04/14/25,-,3.5,-,48.00 百万,2022/4/14,用于项目的建设开发及补充营运资金,--,城投债,103722,2025/4/14
佛山市高明建设投资集团有限公司,FSGMCI 3.5 04/14/25,-,3.5,-,200.00 百万,2022/4/14,根据可持续融资框架，为集团符合条件的项目进行融资或再融资,--,城投债,103727,2025/4/14
浙江长兴金融控股集团有限公司,ZJXCAO 3.7 04/13/25,-,3.7,-,57.50 百万,2022/4/13,绿色债券项目融资包括(i)吉利汽车长兴制造基地项目;(ii)碳中和供应链项目和补充营运资金,--,城投债,103724,2025/4/13
中国光大银行股份有限公司,CHEVBK 3 10/13/22,-,3,-,500.00 百万,2022/4/13,--,--,金融债,104135,2022/10/13
重庆财信企业集团有限公司,CQCASN 4 02/12/25,-,4,-,33.00 百万,2022/4/12,再融资,--,产业债,103728,2025/2/12
中国光大银行股份有限公司,CHEVBK 3 10/12/22,-,3,-,500.00 百万,2022/4/12,--,--,金融债,104114,2022/10/12
青岛胶州城市发展投资有限公司,JZHDIN 4.7 04/11/25,-,4.7,-,150.00 百万,2022/4/11,为集团项目发展融资和补充集团运营资本,--,城投债,103692,2025/4/11
山东省商业集团有限公司,SHDCOM 3.4 04/11/24,-,3.4,-,60.00 百万,2022/4/11,用于一般公司用途，包括零售业务的发展,--,产业债,103711,2024/4/11
金轮天地控股有限公司,GWTH 10 04/11/25,29.916,10,-,494.66 百万,2022/4/11,--,2022/4/11,地产债,103725,2025/4/11
旭辉控股(集团)有限公司,CIFIHG 6.95 04/08/25,-,6.95,-,2545.00 百万,2022/4/8,再融资,2024/4/8,地产债,103704,2025/4/8
德清县文化旅游发展集团有限公司,DQWHLV 4 04/08/25,-,4,-,45.50 百万,2022/4/8,为项目融资和补充运营资本,--,城投债,103705,2025/4/8
德清县文化旅游发展集团有限公司,DQWHLV 3.4 04/08/25,-,3.4,-,49.00 百万,2022/4/8,为项目融资和补充运营资本,--,城投债,103706,2025/4/8
恒基兆业地产有限公司,HENLND 2.4 04/08/24,-,2.4,-,300.00 百万,2022/4/8,--,--,地产债,103709,2024/4/8
力高地产集团有限公司,REDPRO 11 08/06/23,12.27,11,460.825,267.25 百万,2022/4/8,--,2022/4/8,地产债,103715,2023/8/6
力高地产集团有限公司,REDPRO 13 04/07/23,18.466,13,689.791,153.66 百万,2022/4/8,--,2022/4/8,地产债,103716,2023/4/7
集友银行有限公司,CHIYBK 5.75 04/07/32,97.366,5.75,-,200.00 百万,2022/4/7,根据适用的法律和法规补充发行人的二级资本,2027/4/7、2027/10/7、2028/4/7、2028/10/7、2029/4/7、2029/10/7、2030/4/7、2030/10/7、2031/4/7、2031/10/7,金融债,103690,2032/4/7
江苏腾海投资控股集团有限公司,JSTHIG 3.4 04/07/25,-,3.4,-,100.00 百万,2022/4/7,基础设施建设和补充运营资本,--,城投债,103691,2025/4/7
湖州南浔旅游投资发展集团有限公司,HZHNAX 3.2 04/07/25,-,3.2,-,29.00 百万,2022/4/7,为项目建设融资和补充运营资金,--,城投债,103695,2025/4/7
国网国际发展有限公司,CHGRID 3.125 04/07/25,98.26,3.125,3.851,650.00 百万,2022/4/7,一般公司用途,2025/3/7,产业债,103696,2025/4/7
国网国际发展有限公司,CHGRID 3.25 04/07/27,97.793,3.25,3.786,350.00 百万,2022/4/7,根据发行文件中规定的绿色融资框架，对符合要求的绿色资产进行融资和/或再融资,2027/3/7,产业债,103697,2027/4/7
华泰国际金融控股有限公司,HTIFIH 1.5 04/06/23,-,1.5,-,100.00 百万,2022/4/7,运营资本,--,金融债,103699,2023/4/6
华泰国际金融控股有限公司,HTIFIH 1.5 04/06/23,-,1.5,-,100.00 百万,2022/4/7,运营资本,--,金融债,103700,2023/4/6
华泰国际金融控股有限公司,HTIFIH 1.5 04/06/23,-,1.5,-,100.00 百万,2022/4/7,一般企业用途,--,金融债,103701,2023/4/6
南京未来科技城经济发展有限公司,NJZJTD 3.3 04/07/25,-,3.3,-,35.00 百万,2022/4/7,对集团若干建设项目进行融资,--,城投债,103708,2025/4/7
江苏瀚瑞投资控股有限公司,HRINT 6.5 04/07/25,99.933,6.5,6.524,122.00 百万,2022/4/7,再融资,--,城投债,103710,2025/4/7
余姚经济开发区建设投资发展有限公司,YYSCIH 3.9 04/07/25,-,3.9,-,100.00 百万,2022/4/7,为现有离岸债券再融资,--,城投债,103713,2025/4/7
内蒙古包钢钢联股份有限公司,INNMON 5.35 04/06/25,-,5.35,-,100.00 百万,2022/4/6,运营资本,--,产业债,103698,2025/4/6
萍乡市城市建设投资集团有限公司,PXCONS 4.5 03/06/25,100.25,4.5,4.394,244.00 百万,2022/4/6,对现有离岸债务进行再融资,--,城投债,103707,2025/3/6
天风国际证券集团有限公司,TFIOVS 4 04/06/25,-,4,-,50.00 百万,2022/4/6,--,--,金融债,103723,2025/4/6
九龙仓置业地产投资有限公司,WREICL 3.85 04/06/24,-,3.85,-,300.00 百万,2022/4/6,--,--,地产债,103670,2024/4/6
知识城(广州)投资集团有限公司,KCGZIG 3.5 04/06/25,96.843,3.5,4.797,450.00 百万,2022/4/6,净收益将按照债券发行通告中规定的绿色融资框架进行使用,--,城投债,103674,2025/4/6
中国建设银行股份有限公司,CCB 3.1 04/04/23,-,3.1,-,500.00 百万,2022/4/6,--,--,金融债,104188,2023/4/4
郑州航空港兴港投资集团有限公司,ZZAIRI 4.7 04/01/25,97.75,4.7,5.639,200.00 百万,2022/4/1,为发行人的境内项目发展和补充其运营资本,--,城投债,103680,2025/4/1
香港中华煤气有限公司,HKCGAS 2.35 04/01/25,-,2.35,-,250.00 百万,2022/4/1,--,--,产业债,103651,2025/4/1
华泰国际金融控股有限公司,HTIFIH 0.65 09/30/22,-,0.65,-,800.00 百万,2022/4/1,--,--,金融债,103671,2022/9/30
福建石狮国有资本运营集团有限责任公司,SHICAP 4.2 04/01/25,-,4.2,-,143.00 百万,2022/4/1,建设项目和补充运营资本,--,城投债,103675,2025/4/1
工银国际控股有限公司,ICBCIH 3.27 03/31/23,-,3.27,-,1000.00 百万,2022/4/1,--,--,金融债,103677,2023/3/31
MI能源控股有限公司,MIEHOL 0 12/31/24,-,0,-,272.87 百万,2022/3/30,--,--,产业债,103714,2024/12/31
中信信惠国际资本有限公司,CTICPM 4.25 03/30/25,-,4.25,-,270.00 百万,2022/3/30,一般企业用途、再融资,2024/12/31,金融债,103654,2025/3/30
杭州市水务集团有限公司,HZWTGC 2.9 03/30/25,98.285,2.9,3.595,300.00 百万,2022/3/30,根据发行人的绿色融资框架，为符合条件的项目提供全部或部分融资和/或再融资，和相关营运资本目的,--,城投债,103664,2025/3/30
湖州吴兴经开建设投资发展集团有限公司,HZWXED 3.1 03/30/25,-,3.1,-,146.00 百万,2022/3/30,用于产业改善项目和补充营运资金,--,城投债,103667,2025/3/30
甘肃省公路航空旅游投资集团有限公司,GSHIAV 4.9 03/30/25,93.407,4.9,7.747,300.00 百万,2022/3/30,根据2022年2月9日的发改委注册证书进行再融资。将投资于符合发行人可持续融资框架的合格绿色和社会项目,--,城投债,103669,2025/3/30
临沂投资发展集团有限公司,LYINDE 4.5 03/30/25,-,4.5,-,200.00 百万,2022/3/30,为发行人绿色债券框架下的合格项目以及这些项目的一般营运资金,--,城投债,103673,2025/3/30
浙江湖州南浔经济建设开发有限公司,ZJHZNX 3.1 03/30/25,-,3.1,-,28.50 百万,2022/3/30,运营资本,--,城投债,103676,2025/3/30
靖江港口集团有限公司,JJHD 4 03/29/25,-,4,-,19.00 百万,2022/3/29,一般企业用途、运营资本、项目融资,--,城投债,103650,2025/3/29
靖江港口集团有限公司,JJHD 2.8 03/29/25,-,2.8,-,33.00 百万,2022/3/29,一般企业用途、运营资本、项目融资,--,城投债,103652,2025/3/29
正荣地产集团有限公司,ZHPRHK 8 03/06/23,-,8,-,1589.98 百万,2022/3/29,--,2022/3/29,地产债,103656,2023/3/6
正荣地产集团有限公司,ZHPRHK 8 03/06/23,4.333,8,3204.717,728.62 百万,2022/3/29,--,2022/3/29,地产债,103657,2023/3/6
漳州市交通发展集团有限公司,ZZTRAN 3.18 03/28/23,99.175,3.18,4.591,175.00 百万,2022/3/29,对现有债务进行再融资、补充运营资本,--,城投债,103659,2023/3/28
友邦保险控股有限公司,AIA 2.25 03/28/24,-,2.25,-,6500.00 百万,2022/3/29,--,--,金融债,103662,2024/3/28
株洲市城市建设发展集团有限公司,ZZCITY 4.6 03/29/25,98.687,4.6,5.145,400.00 百万,2022/3/29,根据框架和发改委证书为合格绿色项目和现有债务再融资,--,城投债,103668,2025/3/29
香港中华煤气有限公司,HKCGAS 3.74 03/28/25,-,3.74,-,300.00 百万,2022/3/28,资本支出、一般企业用途、再融资,--,产业债,103637,2025/3/28
青岛动车小镇投资集团有限公司,QDHSTI 3.6 03/28/25,-,3.6,-,60.00 百万,2022/3/28,业务经营和补充运营资本,--,城投债,103663,2025/3/28
济南高新控股集团有限公司,BCHINA 2.5 06/23/24,97.91,2.5,3.687,6.00 百万,2022/3/25,--,--,城投债,103754,2024/6/23
中国银行股份有限公司,BCHINA Float 03/25/24,-,O/N TONA+26,-,10000.00 百万,2022/3/25,票据发行的净收益将由发行人用于一般公司用途,--,金融债,103647,2024/3/25
无锡惠山高科有限公司,WXHSHT 3.8 03/24/23,-,3.8,-,45.00 百万,2022/3/25,一般企业用途,--,城投债,103653,2023/3/24
仪征市城市发展投资控股集团有限公司,YZHNGC 2.5 03/24/23,-,2.5,-,50.00 百万,2022/3/25,一般企业用途,--,城投债,103655,2023/3/24
台州市黄岩经济开发集团有限公司,TZHYED 2.98 03/25/25,100.25,2.98,2.878,150.00 百万,2022/3/25,为集团的项目提供资金，并补充集团的营运资金,--,城投债,103658,2025/3/25
湘潭振湘国有资产经营投资有限公司,ZEXIAS 3.3 03/25/25,-,3.3,-,100.00 百万,2022/3/25,为项目建设和补充运营资本,--,城投债,103660,2025/3/25
力高地产集团有限公司,REDPRO 8 03/23/23,18.416,8,685.497,191.60 百万,2022/3/25,投资,--,地产债,103672,2023/3/23
华泰国际金融控股有限公司,HTIFIH 0.95 09/26/22,-,0.95,-,50.00 百万,2022/3/25,--,--,金融债,103678,2022/9/26
华泰国际金融控股有限公司,HTIFIH 1 12/23/22,-,1,-,100.00 百万,2022/3/24,运营资本,--,金融债,103702,2022/12/23
华泰国际金融控股有限公司,HTIFIH 1 12/23/22,-,1,-,100.00 百万,2022/3/24,运营资本,--,金融债,103703,2022/12/23
深圳市卓越商业管理有限公司,EXCECP 2.91 03/24/25,-,2.91,-,100.00 百万,2022/3/24,对2019年4月10日发行的债券(ISIN:XS1978743760)进行再融资,--,地产债,103649,2025/3/24
中华人民共和国,PBOCIN 2.6 09/22/22,-,2.6,-,5000.00 百万,2022/3/24,一般企业用途,--,政府债,103661,2022/9/22
华泰国际金融控股有限公司,HTIFIH 1 12/23/22,-,1,-,50.00 百万,2022/3/24,运营资本,--,金融债,103679,2022/12/23
湖州市南浔区交通投资集团有限公司,NXDTIN 4.5 03/23/25,-,4.5,-,206.00 百万,2022/3/23,若干项目建设和补充运营资本,--,城投债,103646,2025/3/23
如东县民泰城乡建设工程有限公司,MTCONS 2.9 03/23/25,-,2.9,-,100.00 百万,2022/3/23,为发展其基础设施建设业务和补充运营资本,--,城投债,103648,2025/3/23
中国教育集团控股有限公司,CHEDUC 4 03/22/25,-,4,-,500.00 百万,2022/3/22,用于收购中国的大学和/或高等教育机构以及广东省肇庆市广州应用科技学院(前身为广州大学松田学院)新校区一期的建设，并补充海外营运资金,--,产业债,103641,2025/3/22
中原证券股份有限公司,CCNIFH 4 03/22/25,-,4,-,100.00 百万,2022/3/22,为集团的离岸债务再融资、补充公司运营资本以及为其证券业务的发展提供资金,--,金融债,103642,2025/3/22
泰州市新滨江开发有限责任公司,TZNWBN 6 03/22/25,-,6,-,81.00 百万,2022/3/22,为现有离岸债务再融资,--,城投债,103645,2025/3/22
成都东方广益投资有限公司,CHDOGU 3.42 03/21/25,-,3.42,-,170.00 百万,2022/3/21,为现有债务再融资,--,城投债,103632,2025/3/21
交通银行股份有限公司,BOCOM 2.375 03/21/25,96.57,2.375,3.786,400.00 百万,2022/3/21,运营资本和一般公司用途,--,金融债,103633,2025/3/21
交通银行股份有限公司,BOCOM 3.2 03/21/24,-,3.2,-,2800.00 百万,2022/3/21,运营资本和一般公司用途,--,金融债,103634,2024/3/21
中国国际金融(国际)有限公司,CICCHK 2.875 03/21/25,96.737,2.875,4.226,600.00 百万,2022/3/21,偿还若干现有债务，补充营运资金和用于一般公司用途,--,金融债,103635,2025/3/21
交通银行股份有限公司,BOCOM 1.8 03/21/24,-,1.8,-,1200.00 百万,2022/3/21,一般企业用途、运营资本,--,金融债,103636,2024/3/21
成都怡都建设投资有限公司,CYICIC 3 03/18/25,-,3,-,100.00 百万,2022/3/18,为建设青白江区红阳街道宏翔乐居安置房建设项目和水韵姚渡安置房项目以及补充运营资本,--,城投债,103550,2025/3/18
中国建设银行股份有限公司,CCB 3.15 03/17/23,-,3.15,-,300.00 百万,2022/3/18,--,--,金融债,104148,2023/3/17
交通银行股份有限公司,BOCOM 3.15 03/17/23,-,3.15,-,300.00 百万,2022/3/18,--,--,金融债,104156,2023/3/17
中国建设银行股份有限公司,CCB 3 03/17/23,-,3,-,518.00 百万,2022/3/18,--,--,金融债,104161,2023/3/17
晋江市路桥建设开发有限公司,JJUCID 3.2 03/16/23,-,3.2,-,158.00 百万,2022/3/17,用于项目建设、偿还现有债务和补充运营资金,--,城投债,103629,2023/3/16
上汽通用汽车金融有限责任公司,GMACSA 3.2 03/17/25,-,3.2,-,1000.00 百万,2022/3/17,--,--,产业债,103631,2025/3/17
荣盛房地产发展股份有限公司,RISSUN 9.5 03/16/23,20.562,9.5,652.756,200.71 百万,2022/3/17,再融资,2022/3/17,地产债,103643,2023/3/16
荣盛房地产发展股份有限公司,RISSUN 9.5 09/17/24,20.75,9.5,121.356,540.00 百万,2022/3/17,再融资,2022/3/17,地产债,103644,2024/9/17
申万宏源证券有限公司,SWHYSE 2.625 03/16/25,96.333,2.625,4.15,300.00 百万,2022/3/16,根据发改委和国家外汇管理局的规定，补充营运资金以及支持集团发展海外业务,--,金融债,103623,2025/3/16
绍兴市柯桥区国有资产投资经营集团有限公司,KQSOAI 3 03/16/25,87.56,3,8.505,300.00 百万,2022/3/16,项目建设，补充营运资金,--,城投债,103624,2025/3/16
嵊州市城市建设投资发展集团有限公司,SHZHCI 2.7 03/16/25,-,2.7,-,143.00 百万,2022/3/16,项目建设，补充营运资金,--,城投债,103625,2025/3/16
洛阳龙门旅游集团有限公司,LMTOUR 2.98 02/16/24,-,2.98,-,58.00 百万,2022/3/16,项目建设和补充运营资本,--,城投债,103626,2024/2/16
宁海县国有资产投资控股集团有限公司,NHSOAI 3.65 03/16/25,-,3.65,-,120.00 百万,2022/3/16,用于一般公司用途和项目建设，补充营运资金,--,城投债,103627,2025/3/16
河南省铁路建设投资集团有限公司,HNRAIL 3.214 03/15/27,-,3.214,-,100.00 百万,2022/3/15,根据绿色金融框架，对符合条件的绿色项目融资、再融资和补充运营资本,--,城投债,103572,2027/3/15
平度市国有资产经营管理有限公司,PDSOAM 5 03/15/25,-,5,-,100.00 百万,2022/3/15,用于补充营运资金,--,城投债,103604,2025/3/15
浙江天子湖实业投资有限公司,ZJTZLI 2.7 03/15/25,-,2.7,-,38.40 百万,2022/3/15,一般企业用途、运营资本、项目融资,--,城投债,103605,2025/3/15
中国建设银行股份有限公司,CCB 3.1 03/14/23,-,3.1,-,200.00 百万,2022/3/15,--,--,金融债,104137,2023/3/14
上海复星高科技(集团)有限公司,FSHITZ 3 03/15/25,-,3,-,150.00 百万,2022/3/15,为现有债务进行再融资,--,产业债,103628,2025/3/15
天风证券股份有限公司,TIANFS 4 03/15/24,95.741,4,6.927,340.00 百万,2022/3/15,为现有离岸债务再融资,--,金融债,103630,2024/3/15
希慎兴业有限公司,HYSAN 1.75 03/14/24,-,1.75,-,150.00 百万,2022/3/14,一般企业用途,--,地产债,103548,2024/3/14
中国建设银行股份有限公司,CCB 3.14 03/13/23,-,3.14,-,500.00 百万,2022/3/14,--,--,金融债,104123,2023/3/13
周口市城建投资发展有限公司,ZKCONS 4.8 03/11/25,-,4.8,-,120.00 百万,2022/3/11,用于补充营运资金和一般公司用途,--,城投债,103556,2025/3/11
东亚银行有限公司,BNKEA Float 03/11/25,-,O/N SOFR+62,-,20.00 百万,2022/3/11,一般企业用途,--,金融债,103559,2025/3/11
延安旅游(集团)有限公司,YATOUR 3.9 03/10/25,-,3.9,-,77.00 百万,2022/3/10,为项目建设融资和补充运营资本,--,城投债,103549,2025/3/10
新疆金融投资有限公司,XJFINV 2.88 03/09/25,-,2.88,-,70.00 百万,2022/3/9,为现有债务再融资,--,城投债,103551,2025/3/9
新疆金融投资有限公司,XJFINV 2.7 02/06/25,-,2.7,-,15.00 百万,2022/3/9,为现有债务再融资,--,城投债,103555,2025/2/6
铁岭公共资产投资运营集团有限公司,TLPUBL 9.3 03/09/25,-,9.3,-,50.00 百万,2022/3/9,再融资,--,城投债,103557,2025/3/9
景瑞控股有限公司,JINGRU 12.75 09/09/23,7.875,12.75,573.802,171.11 百万,2022/3/9,再融资,--,地产债,103621,2023/9/9
中国工商银行股份有限公司,ICBCAS 3 03/08/23,-,3,-,300.00 百万,2022/3/9,--,--,金融债,104149,2023/3/8
中国工商银行股份有限公司,ICBCAS 3.1 03/09/23,-,3.1,-,200.00 百万,2022/3/9,--,--,金融债,104163,2023/3/9
万国数据控股有限公司,GDSHDG 0.25 03/08/29,-,0.25,-,620.00 百万,2022/3/8,用于开发及收购新的数据中心、一般企业用途及营运资金需求。,--,产业债,103523,2029/3/8
怀远县新型城镇化建设有限公司,HYNUCO 3 03/08/25,96.495,3,4.475,100.00 百万,2022/3/8,用于项目建设和补充营运资金,--,城投债,103546,2025/3/8
武汉当代科技产业集团股份有限公司,DANDAI 9 03/07/23,98.754,9,11.445,200.00 百万,2022/3/8,一般企业用途、再融资,--,产业债,103558,2023/3/7
银城国际控股有限公司,YCINTL 13 03/07/23,45,13,247.535,95.96 百万,2022/3/8,--,2022/3/8,地产债,103622,2023/3/7
中国建设银行股份有限公司,CCB 3.12 03/07/23,-,3.12,-,200.00 百万,2022/3/8,--,--,金融债,104174,2023/3/7
中国银行股份有限公司,BCHINA 2 03/07/25,95.952,2,3.687,400.00 百万,2022/3/7,为中国银行可持续发展系列债券管理声明中定义的符合条件的可持续发展项目提供融资和/或再融资,--,金融债,103541,2025/3/7
中国航空技术国际控股有限公司,CATIC 3 03/07/27,92.015,3,4.989,200.00 百万,2022/3/7,根据发行人的绿色债券框架，为现有离岸债务进行再融资,2027/2/7,产业债,103542,2027/3/7
新疆金融投资有限公司,XJFINV 2.7 03/07/25,-,2.7,-,28.00 百万,2022/3/7,为现有债务再融资,--,城投债,103543,2025/3/7
新疆金融投资有限公司,XJFINV 2.7 03/07/25,-,2.7,-,20.00 百万,2022/3/7,为现有债务再融资,--,城投债,103544,2025/3/7
新疆金融投资有限公司,XJFINV 5.6 03/07/25,-,5.6,-,67.00 百万,2022/3/7,再融资,--,城投债,103545,2025/3/7
信银(香港)投资有限公司,CNCBHK 1.833 03/06/23,-,1.833,-,200.00 百万,2022/3/7,再融资,--,金融债,103547,2023/3/6
中国建设银行股份有限公司,CCB 2.9 03/03/23,-,2.9,-,500.00 百万,2022/3/7,--,--,金融债,104116,2023/3/3
湖北省联合发展投资集团有限公司,HBSLFT 3.1 03/04/25,95.346,3.1,5.086,300.00 百万,2022/3/4,根据发行人的绿色债券框架，为符合条件的绿色项目提供资金和补充营运资本,--,城投债,103537,2025/3/4
中国金茂控股集团有限公司,CHJMAO 4.4 03/04/25,86.917,4.4,10.424,350.00 百万,2022/3/4,为一年内到期的现有中长期离岸债务再融资,--,地产债,103539,2025/3/4
中国金茂控股集团有限公司,BCHINA 4.4 03/04/25,101.65,4.4,3.709,8.00 百万,2022/3/4,--,--,地产债,104316,2025/3/4
中国建设银行股份有限公司,CCB 3.11 03/03/23,-,3.11,-,500.00 百万,2022/3/4,--,--,金融债,104110,2023/3/3
中国建设银行股份有限公司,CCB 3.1 03/03/23,-,3.1,-,400.00 百万,2022/3/4,--,--,金融债,104120,2023/3/3
中伟新材料股份有限公司,CNGRAM 4.55 03/03/27,-,4.55,-,100.00 百万,2022/3/3,根据担保人的绿色融资框架，相当于债券发行净收益的金额将用于合格资产的融资和/或再融资,--,产业债,103532,2027/3/3
华泰证券股份有限公司,HTSC 2.375 03/03/25,95.739,2.375,4.171,1000.00 百万,2022/3/3,按照国家发改委和国家外汇管理局的有关规定，偿还海外到期债务，支持华泰国际海外业务的发展,--,金融债,103533,2025/3/3
丽水经济技术开发区实业发展集团有限公司,LSECTZ 2.7 03/03/25,-,2.7,-,100.00 百万,2022/3/3,用于项目建设和一般公司用途,--,城投债,103534,2025/3/3
丽水经济技术开发区实业发展集团有限公司,LSECTZ 2.7 03/03/25,-,2.7,-,100.00 百万,2022/3/3,用于项目建设和一般公司用途,--,城投债,103535,2025/3/3
青岛胶州湾发展集团有限公司,QDJZWD 3.2 03/03/25,96.688,3.2,4.603,300.00 百万,2022/3/3,根据发行人的绿色融资框架，为合格的绿色项目进行融资和补充营运资金,--,城投债,103538,2025/3/3
招商银行股份有限公司,CHINAM 2 03/02/25,95.705,2,3.803,400.00 百万,2022/3/2,为招商银行绿色、社会责任与可持续发展债券框架中定义的合格绿色项目提供融资和/或再融资,--,金融债,103526,2025/3/2
衢州市国有资本运营有限公司,QZSOAT 3 03/02/25,100.088,3,2.963,470.00 百万,2022/3/2,根据发行人的可持续融资框架及其发改委证书，对发行人的新的或现有的合格项目进行全部或部分融资和/或再融资,--,城投债,103527,2025/3/2
国银租赁(国际)有限公司,CDBLFD 2.75 03/02/25,96.178,2.75,4.368,700.00 百万,2022/3/2,为国银租赁提供运营资金和用于一般公司用途,--,金融债,103528,2025/3/2
国银租赁(国际)有限公司,CDBLFD 3.125 03/02/27,94.902,3.125,4.379,250.00 百万,2022/3/2,为国银租赁提供运营资金和用于一般公司用途,--,金融债,103529,2027/3/2
招银国际租赁管理有限公司,CMINLE Float 03/01/23,-,O/N SOFR+80,-,115.00 百万,2022/3/2,--,--,金融债,103530,2023/3/1
云南省投资控股集团有限公司,YUNINV 6.5 03/02/25,98.312,6.5,7.243,200.00 百万,2022/3/2,为担保人及其子公司现有离岸债务再融资,--,城投债,103536,2025/3/2
湖州吴兴城市投资发展集团有限公司,HZWXTZ 4 03/02/25,-,4,-,80.00 百万,2022/3/2,在岸项目建设和运营资本,--,城投债,103540,2025/3/2
中国旅游集团有限公司,CHITRA 2.95 03/01/27,95.611,2.95,4.022,700.00 百万,2022/3/1,用于置换和偿还现有离岸债务以及补充运营资本,--,产业债,103519,2027/3/1
中国农业银行股份有限公司,AGRBK 2.9 03/01/24,-,2.9,-,1300.00 百万,2022/3/1,一般企业用途,--,金融债,103520,2024/3/1
中国农业银行股份有限公司,AGRBK 2 03/01/25,95.892,2,3.724,600.00 百万,2022/3/1,为农业银行香港分行可持续债券框架中定义的合格绿色资产提供融资和/或再融资,--,金融债,103521,2025/3/1
中国农业银行股份有限公司,AGRBK 2.25 03/01/27,94.032,2.25,3.696,300.00 百万,2022/3/1,为农业银行香港分行可持续债券框架中定义的合格绿色资产提供融资和/或再融资,--,金融债,103522,2027/3/1
中国建设银行股份有限公司,CCB 3.05 03/01/23,-,3.05,-,375.00 百万,2022/3/1,--,--,金融债,104138,2023/3/1
富皋万泰集团有限公司,FBWTTZ 4.2 02/28/25,100.075,4.2,4.168,130.00 百万,2022/2/28,为项目建设和补充运营资本,--,城投债,103524,2025/2/28
淮安市投资控股集团有限公司,HACWAM 3.3 02/28/25,98.43,3.3,3.962,300.00 百万,2022/2/28,为偿还集团的离岸未偿债务,--,城投债,103525,2025/2/28
南京扬子国资投资集团有限责任公司,BCHINA 4.3 06/05/24,101.098,4.3,3.654,2.00 百万,2022/2/28,--,--,城投债,104299,2024/6/5
科学城(广州)投资集团有限公司,BCHINA 2.95 03/30/24,98.929,2.95,3.643,3.00 百万,2022/2/28,--,--,城投债,104300,2024/3/30
无锡市建设发展投资有限公司,BCHINA 1.95 12/14/24,96.184,1.95,3.69,1.00 百万,2022/2/28,--,--,城投债,104307,2024/12/14
丹阳投资集团有限公司,PHCIIL 2.5 02/25/25,83.427,2.5,10.165,50.00 百万,2022/2/25,现有债务再融资,--,城投债,103515,2025/2/25
中国铝业集团有限公司,CHALUM 2.95 02/24/27,94.504,2.95,4.307,600.00 百万,2022/2/24,发行所得将用于为本公司的现有离岸债务进行再融资,2027/1/24,产业债,103505,2027/2/24
美的集团股份有限公司,MIDEAZ 2.88 02/24/27,93.726,2.88,4.434,450.00 百万,2022/2/24,发行所得将用于根据绿色融资框架为符合条件的绿色资产提供融资和/或再融资,2027/1/24,产业债,103506,2027/2/24
中国银行股份有限公司,BCHINA 2 02/24/25,96.037,2,3.675,550.00 百万,2022/2/24,一般企业用途,--,金融债,103512,2025/2/24
中国银行股份有限公司,BCHINA 2.375 02/24/27,94.707,2.375,3.662,450.00 百万,2022/2/24,一般企业用途,--,金融债,103513,2027/2/24
国泰君安国际控股有限公司,GUOTJU 1.29 08/24/22,-,1.29,-,50.00 百万,2022/2/24,一般企业用途,--,金融债,103516,2022/8/24
济南高新控股集团有限公司,BCHINA 3.3 12/14/23,99.572,3.3,3.626,5.00 百万,2022/2/24,--,--,城投债,104301,2023/12/14
郑州地铁集团有限公司,BCHINA 1.915 11/15/24,96.25,1.915,3.684,3.00 百万,2022/2/24,--,--,城投债,104305,2024/11/15
北京环境卫生工程集团有限公司,BCHINA 1.65 09/24/24,95.976,1.65,3.673,4.00 百万,2022/2/24,--,--,产业债,104309,2024/9/24
济南城市建设集团有限公司,BCHINA 2.4 09/23/26,95.061,2.4,3.715,2.50 百万,2022/2/24,--,--,城投债,104310,2026/9/23
台州市城市建设投资发展集团有限公司,BCHINA 2.65 10/22/23,98.903,2.65,3.618,3.00 百万,2022/2/24,--,--,城投债,104312,2023/10/22
北京国有资本运营管理有限公司,BJASST 1.206 02/23/25,-,1.206,-,1000.00 百万,2022/2/23,为偿还现有债务,2025/1/23,城投债,103507,2025/2/23
淮北市建投控股集团有限公司,HBCITY 2.9 02/23/25,-,2.9,-,150.00 百万,2022/2/23,再融资,--,城投债,103509,2025/2/23
中华人民共和国,PBOCIN 2.5 05/25/22,-,2.5,-,10000.00 百万,2022/2/23,--,--,政府债,103517,2022/5/25
中华人民共和国,PBOCIN 2.7 02/23/23,-,2.7,-,15000.00 百万,2022/2/23,--,--,政府债,103518,2023/2/23
国瑞置业有限公司,GUOPRO 14.25 08/23/24,32,14.25,97.745,334.79 百万,2022/2/23,--,2022/2/23、2024/5/25,地产债,103531,2024/8/23
河南投资集团有限公司,BCHINA 2.2 08/25/24,97.192,2.2,3.666,3.70 百万,2022/2/23,--,--,城投债,104317,2024/8/25
工银国际租赁财务有限公司,BCHINA 2.125 01/27/25,96.377,2.125,3.7,3.00 百万,2022/2/23,--,--,金融债,104318,2025/1/27
中华人民共和国(香港特区政府),HKGB 0.94 02/21/24,-,0.94,-,1200.00 百万,2022/2/21,--,--,政府债,103514,2024/2/21
成都市羊安新城开发建设有限公司,YANNEW 1.85 02/17/25,-,1.85,-,12.00 百万,2022/2/17,运营资本,--,城投债,103466,2025/2/17
海通国际证券集团有限公司,HTISEC 1 02/16/23,-,1,-,1025.00 百万,2022/2/17,--,--,金融债,103485,2023/2/16
中国银行(香港)有限公司,BOCHKL 1.33 02/17/24,-,1.33,-,2000.00 百万,2022/2/17,如发行人的可持续系列债券管理声明所定义，为低碳基础设施相关的合格项目提供融资和/或再融资，以促进可再生能源和绿色建筑行业的可持续发展和智慧生活。,--,金融债,103488,2024/2/17
中国中信股份有限公司,CITLTD 3.5 02/17/32,90.33,3.5,4.78,300.00 百万,2022/2/17,净收益用于中信股份的一般企业用途，包括但不限于为其债务再融资,2031/11/17,金融债,103489,2032/2/17
中国中信股份有限公司,CITLTD 2.875 02/17/27,94.244,2.875,4.301,800.00 百万,2022/2/17,净收益用于中信股份的一般企业用途，包括但不限于为其债务再融资,2027/1/17,金融债,103490,2027/2/17
中华人民共和国(香港特区政府),GBHK Float 02/17/23,-,O/N HONIA+5,-,1000.00 百万,2022/2/17,--,--,政府债,103508,2023/2/17
新濠影汇投资有限公司,STDCTY 7 02/15/27,-,7,-,350.00 百万,2022/2/16,部分用于Studio City的剩余项目资本支出和一般公司用途,2024/2/15、2025/2/15、2026/2/15,产业债,103479,2027/2/15
新濠影汇投资有限公司,STDCTY 7 02/15/27,-,7,-,350.00 百万,2022/2/16,部分用于Studio City的剩余项目资本支出和一般公司用途,2024/2/15、2025/2/15、2026/2/15,产业债,103480,2027/2/15
中国银行股份有限公司,BCHINA 1.875 02/16/25,95.766,1.875,3.68,300.00 百万,2022/2/16,为中国银行可持续发展系列债券管理声明中定义的合格绿色项目融资和/或再融资,--,金融债,103481,2025/2/16
中国银行股份有限公司,BCHINA 1.625 02/16/24,97.142,1.625,3.632,300.00 百万,2022/2/16,为中国银行可持续发展系列债券管理声明中定义的符合条件的绿色项目提供融资和/或再融资,--,金融债,103482,2024/2/16
国家开发银行,SDBC 2 02/16/27,94.223,2,3.402,550.00 百万,2022/2/16,用作运营资本和一般企业用途,--,金融债,103483,2027/2/16
国家开发银行,SDBC 1.6 02/16/25,-,1.6,-,5300.00 百万,2022/2/16,用作运营资本和一般企业用途,--,金融债,103484,2025/2/16
会德丰有限公司,WHEELK 1.8 02/11/25,-,1.8,-,300.00 百万,2022/2/11,--,--,地产债,103469,2025/2/11
东亚银行有限公司,BNKEA 1.94 02/10/25,96.647,1.94,3.379,30.00 百万,2022/2/10,--,--,金融债,103471,2025/2/10
江苏洋口港投资开发有限公司,JSYKPI 2.8 02/08/23,-,2.8,-,48.00 百万,2022/2/9,运营资本、再融资,--,城投债,103467,2023/2/8
湖州新型城市投资发展集团有限公司,HZZLDE 4.5 02/09/25,-,4.5,-,265.00 百万,2022/2/9,一般企业用途,--,城投债,103472,2025/2/9
中国工商银行股份有限公司,ICBCAS 1.48 02/09/24,-,1.48,-,40.00 百万,2022/2/9,--,--,金融债,103473,2024/2/9
恒基兆业地产有限公司,HENLND 3.3 02/07/24,-,3.3,-,400.00 百万,2022/2/7,--,--,地产债,103468,2024/2/7
龙光集团有限公司,LOGPH 6.95 08/04/26,-,6.95,-,1950.00 百万,2022/2/4,再融资,2024/5/4,地产债,103470,2026/8/4
海通国际证券集团有限公司,HTISEC 0.6 08/01/22,-,0.6,-,20.00 百万,2022/1/31,一般企业用途、运营资本,--,金融债,103465,2022/8/1
碧桂园控股有限公司,COGARD 4.95 07/28/26,-,4.95,-,3900.00 百万,2022/1/28,用于为将于一年内到期的现有中长期境外债项进行再融资。,2024/1/28,地产债,103442,2026/7/28
中国信达(香港)控股有限公司,CCAMCL 3.25 01/28/27,90.546,3.25,5.696,1000.00 百万,2022/1/28,根据适用法律和国家发改委登记文件对现有债务进行再融资,2026/10/28,金融债,103458,2027/1/28
恒基兆业地产有限公司,HENLND 1.65 01/28/24,-,1.65,-,200.00 百万,2022/1/28,--,--,地产债,103460,2024/1/28
中国工商银行股份有限公司,ICBCAS Float 01/28/25,-,SOFR+50,-,20.00 百万,2022/1/28,--,--,金融债,103461,2025/1/28
华泰国际金融控股有限公司,HTIFIH 0.8 07/28/22,-,0.8,-,100.00 百万,2022/1/28,--,--,金融债,103462,2022/7/28
泰兴市智光环保科技有限公司,ZGENV 1.95 01/27/23,-,1.95,-,50.00 百万,2022/1/28,偿还现有债务、补充运营资本和一般企业用途,--,产业债,103463,2023/1/27
申万宏源(香港)有限公司,SWHYHK 1 01/27/23,-,1,-,140.00 百万,2022/1/28,一般企业用途,--,金融债,103464,2023/1/27
瑞幸咖啡,LKNCY 9 01/28/27,95.875,9,10.176,109.85 百万,2022/1/28,--,2022/1/28,产业债,103478,2027/1/28
绿城中国控股有限公司,GRNCH 2.3 01/27/25,92,2.3,5.887,400.00 百万,2022/1/27,根据发行人的绿色金融框架，为现有债务再融资,--,地产债,103436,2025/1/27
申万宏源(香港)有限公司,SWHYHK 1.5 01/26/23,-,1.5,-,200.00 百万,2022/1/27,为一般公司用途,--,金融债,103439,2023/1/26
工银国际租赁财务有限公司,ICBCIL 2.125 01/27/25,95.067,2.125,4.289,700.00 百万,2022/1/27,为普通交易中的资产收购、再融资和其他一般公司用途,--,金融债,103440,2025/1/27
工银国际租赁财务有限公司,ICBCIL 2.7 01/27/27,93.548,2.7,4.317,500.00 百万,2022/1/27,为普通交易中的资产收购、再融资和其他一般公司用途,--,金融债,103441,2027/1/27
泰安市城市发展投资有限公司,TAICIT 3.75 01/26/23,-,3.75,-,110.00 百万,2022/1/27,为一般公司用途和现有债务再融资,--,城投债,103453,2023/1/26
景业名邦集团控股有限公司,JYGMHD 7.5 01/26/23,-,7.5,-,152.10 百万,2022/1/27,一般企业用途、项目融资、再融资,--,地产债,103456,2023/1/26
淄博高新国有资本投资有限公司,ZBTECH 4.9 01/26/23,-,4.9,-,71.00 百万,2022/1/27,再融资,--,城投债,103457,2023/1/26
珠海华发实业股份有限公司,HUAFAI 4.2 01/26/23,-,4.2,-,200.00 百万,2022/1/27,为现有离岸债务再融资,--,地产债,103459,2023/1/26
河南省铁路建设投资集团有限公司,HNRAIL 2.2 01/26/25,93.647,2.2,5.02,400.00 百万,2022/1/26,根据绿色金融框架，对符合条件的绿色项目融资、再融资和补充运营资本,--,城投债,103430,2025/1/26
曹妃甸国控投资集团有限公司,CFDGKI 2.1 12/25/24,-,2.1,-,100.00 百万,2022/1/25,运营资本,--,城投债,103424,2024/12/25
衢州市交通投资集团有限公司,QZTRIN 2.5 01/25/25,95.5,2.5,4.482,200.00 百万,2022/1/25,绿色债券/贷款,--,城投债,103431,2025/1/25
湖州南浔旅游投资发展集团有限公司,HZHNAX 2.15 01/25/25,-,2.15,-,48.00 百万,2022/1/25,为项目建设融资和补充运营资本,--,城投债,103437,2025/1/25
富港建设集团有限公司,RGCFGE 2.1 01/25/25,-,2.1,-,100.00 百万,2022/1/25,用于项目建设和流动性补充,--,城投债,103438,2025/1/25
富港建设集团有限公司,RGCFGE 2.1 01/25/25,-,2.1,-,50.00 百万,2022/1/25,项目融资,--,城投债,103451,2025/1/25
富港建设集团有限公司,RGCFGE 2.1 01/25/25,-,2.1,-,50.00 百万,2022/1/25,项目融资,--,城投债,103452,2025/1/25
广东省交通集团有限公司,GDCOMM 2.358 01/25/27,92.1,2.358,4.342,500.00 百万,2022/1/25,用于项目建设、再融资和运营资本,--,城投债,103421,2027/1/25
湖州市城市投资发展集团有限公司,HZCONI 2.85 01/25/25,95.28,2.85,4.944,300.00 百万,2022/1/25,债券发行的净收益将用于补充营运资本和一般公司用途,--,城投债,103422,2025/1/25
江苏皋开投资发展集团有限公司,JSGKID 2.1 01/24/25,-,2.1,-,100.00 百万,2022/1/24,为项目建设和发展融资，以及补充运营资本,--,城投债,103427,2025/1/24
湖州莫干山高新集团有限公司,HZMGSG 3.4 01/24/25,100.375,3.4,3.236,210.00 百万,2022/1/24,为集团项目的发展融资以及补充集团的营运资金,--,城投债,103432,2025/1/24
浙商银行股份有限公司,ZHESHG 0 12/20/22,-,0,-,40.00 百万,2022/1/24,--,--,金融债,103433,2022/12/20
湖州南浔新城投资发展集团有限公司,NXNTID 2.25 01/24/25,-,2.25,-,28.60 百万,2022/1/24,项目融资,--,城投债,103450,2025/1/24
恒隆地产有限公司,HLPPY 2.75 01/24/29,-,2.75,-,590.00 百万,2022/1/24,绿色债券/贷款,--,地产债,103417,2029/1/24
太古股份有限公司,SWIRE 2.83 01/24/32,-,2.83,-,500.00 百万,2022/1/24,--,--,地产债,103419,2032/1/24
恒基兆业地产有限公司,HENLND 1.65 01/24/24,-,1.65,-,200.00 百万,2022/1/24,--,--,地产债,103420,2024/1/24
焦作市投资集团有限公司,JZINVT 5.5 01/20/23,-,5.5,-,100.00 百万,2022/1/21,一般企业用途、运营资本、项目融资、再融资,--,城投债,103425,2023/1/20
绍兴市城市建设投资集团有限公司,SXUCI 3.65 01/21/27,-,3.65,-,1000.00 百万,2022/1/21,一般企业用途,2026/10/21,城投债,103426,2027/1/21
抚州市数字经济投资集团有限公司,FZSZJJ 1.98 01/21/25,-,1.98,-,98.00 百万,2022/1/21,项目建设和一般运营资本,--,城投债,103379,2025/1/21
中国建设银行股份有限公司,CCB 2.85 01/21/32,94.507,2.85,4.229,2000.00 百万,2022/1/21,根据适用的法律和法规，将被确认为发行人的二级资本,2027/1/21,金融债,103409,2032/1/21
济南章丘控股集团有限公司,JNZQHD 3.8 01/20/23,-,3.8,-,105.00 百万,2022/1/21,为现有离岸债务再融资,--,城投债,103412,2023/1/20
浙江钱塘江投资开发有限公司,HNJSDV 2.1 01/21/25,-,2.1,-,80.00 百万,2022/1/21,运营资本、项目融资,--,城投债,103416,2025/1/21
东台市交通投资建设集团有限公司,DOTACI 5.8 07/20/22,-,5.8,-,65.00 百万,2022/1/21,为偿还债务、补充日常营运资金以及其他一般公司用途,--,城投债,103423,2022/7/20
禹洲集团控股有限公司,YUZHOU 7.8125 01/21/23,7.05,7.8125,-,527.89 百万,2022/1/20,--,2022/1/20,地产债,103449,2023/1/21
宜春市袁州区国投集团有限公司,YZHGOT 1.98 01/20/25,-,1.98,-,98.00 百万,2022/1/20,--,--,城投债,103407,2025/1/20
国泰君安国际控股有限公司,GUOTJU 0.8 07/20/22,-,0.8,-,1200.00 百万,2022/1/20,--,--,金融债,103411,2022/7/20
泰兴市智光环保科技有限公司,ZGENV 1.95 01/19/23,-,1.95,-,100.00 百万,2022/1/20,运营资本、再融资,--,产业债,103415,2023/1/19
淄博市淄川区财金控股有限公司,ZBZCHD 3 01/20/25,-,3,-,42.00 百万,2022/1/20,项目融资,--,城投债,103418,2025/1/20
广州开发区控股集团有限公司,GZGETH 2.85 01/19/27,92.013,2.85,4.888,490.00 百万,2022/1/19,债券发行的净收益将用于公司绿色融资框架中规定的符合条件的绿色项目融资和/或再融资，并将用作与符合条件的绿色项目相关的营运资金,--,城投债,103395,2027/1/19
领展房地产投资信托基金,LINREI 2.75 01/19/32,87.414,2.75,4.398,600.00 百万,2022/1/19,一般企业用途,--,地产债,103399,2032/1/19
中国诚通香港有限公司,CCTOHK 2 01/19/25,94.043,2,4.65,300.00 百万,2022/1/19,用于营运资金、偿还现有债务、根据监管批准的项目和其他一般公司用途,--,产业债,103405,2025/1/19
中国诚通香港有限公司,CCTOHK 2.75 01/19/27,92.435,2.75,4.671,400.00 百万,2022/1/19,用于营运资金、偿还现有债务、根据监管批准的项目和其他一般公司用途,--,产业债,103406,2027/1/19
建德市国有资产经营有限公司,JDSOAM 2.05 01/19/25,-,2.05,-,55.00 百万,2022/1/19,项目融资、再融资,--,城投债,103414,2025/1/19
祥生地产集团有限公司,SHXREG 13 01/17/23,-,13,-,134.47 百万,2022/1/18,--,--,地产债,103428,2023/1/17
祥生控股(集团)有限公司,SHNSUN 13 01/17/23,-,13,-,86.20 百万,2022/1/18,再融资,--,地产债,103429,2023/1/17
香港电讯(HKT)有限公司,HKTGHD 3 01/18/32,86.577,3,4.79,650.00 百万,2022/1/18,一般公司用途，包括偿还现有债务,2031/10/18,产业债,103396,2032/1/18
北京市燃气集团有限责任公司,BJGASG 1.875 01/18/25,94.603,1.875,4.241,500.00 百万,2022/1/18,净收益或同等金额将用于担保人绿色金融框架下所述符合条件的绿色项目融资和/或再融资,--,产业债,103397,2025/1/18
中国农业银行股份有限公司,AGRBK 1.5 01/18/25,95.339,1.5,3.544,400.00 百万,2022/1/18,一般企业用途,--,金融债,103402,2025/1/18
中国农业银行股份有限公司,AGRBK 2 01/18/27,93.247,2,3.676,300.00 百万,2022/1/18,为发行人绿色融资框架中定义的合格绿色项目融资和/或再融资,--,金融债,103403,2027/1/18
江苏瑞海投资控股集团有限公司,JSRUIH 1.9 01/17/23,-,1.9,-,100.00 百万,2022/1/18,为其债务再融资以及补充营运资金,--,城投债,103404,2023/1/17
会德丰有限公司,WHEELK 1.75 01/17/25,-,1.75,-,325.00 百万,2022/1/17,--,--,地产债,103381,2025/1/17
会德丰有限公司,WHEELK 1.93 01/14/26,-,1.93,-,300.00 百万,2022/1/14,--,--,地产债,103370,2026/1/14
温州市鹿城区国有控股集团有限公司,WZLCSO 4.1 01/14/25,-,4.1,-,972.00 百万,2022/1/14,项目建设和一般运营资本,--,城投债,103398,2025/1/14
重庆国际物流枢纽园区建设有限责任公司,CQLGST 5.3 01/14/25,-,5.3,-,37.50 百万,2022/1/14,为现有债务再融资和/或经中国有关监管机构批准的其他用途,--,城投债,103400,2025/1/14
江苏叠石桥家纺产业集团有限公司,JSDSQI 3 01/14/25,-,3,-,35.00 百万,2022/1/14,为现有债务再融资、补充运营资金,--,产业债,103401,2025/1/14
贵阳经济开发区城市建设投资(集团)股份有限公司,GYECTE 3 01/13/23,-,3,-,21.50 百万,2022/1/14,一般企业用途,--,城投债,103408,2023/1/13
大发地产集团有限公司,DAFAPG 12.5 06/30/22,6,12.5,-,138.38 百万,2022/1/14,--,2022/1/14,地产债,103413,2022/6/30
恒隆地产有限公司,HLPPY 2.75 01/13/29,-,2.75,-,605.00 百万,2022/1/13,绿色债券/贷款,--,地产债,103382,2029/1/13
创科实业有限公司,TECHTR 2.79 01/13/32,-,2.79,-,50.00 百万,2022/1/13,一般企业用途、运营资本,--,产业债,103383,2032/1/13
盛虹炼化(连云港)有限公司,SHPEIN 1.9 01/12/23,-,1.9,-,40.00 百万,2022/1/13, 一般企业用途,--,产业债,103384,2023/1/12
恒基兆业地产有限公司,HENLND 1.6 01/13/24,-,1.6,-,300.00 百万,2022/1/13,一般企业用途,--,地产债,103385,2024/1/13
海通国际证券集团有限公司,HTISEC 0.75 07/13/22,-,0.75,-,60.00 百万,2022/1/13,一般企业用途、运营资本,--,金融债,103390,2022/7/13
中国美东汽车控股有限公司,MEIDON 0 01/13/27,-,0,-,2750.00 百万,2022/1/13,一般企业用途、运营资本、投资,2025/1/13,产业债,103410,2027/1/13
香港机场管理局,HKAA 3.25 01/12/52,79.098,3.25,4.546,1200.00 百万,2022/1/12,发行人将债券的净收益用于其资本支出，包括三跑道系统项目的资本支出和一般公司用途,2051/7/12,产业债,103371,2052/1/12
香港机场管理局,HKAA 3.25 01/12/52,79.098,3.25,4.546,1200.00 百万,2022/1/12,发行人将债券的净收益用于其资本支出，包括三跑道系统项目的资本支出和一般公司用途,2051/7/12,产业债,103372,2052/1/12
香港机场管理局,HKAA 3.5 01/12/62,80.502,3.5,4.572,600.00 百万,2022/1/12,发行人将债券的净收益用于其资本支出，包括三跑道系统项目的资本支出和一般公司用途,2061/7/12,产业债,103373,2062/1/12
香港机场管理局,HKAA 3.5 01/12/62,80.502,3.5,4.572,600.00 百万,2022/1/12,发行人将债券的净收益用于其资本支出，包括三跑道系统项目的资本支出和一般公司用途,2061/7/12,产业债,103374,2062/1/12
香港机场管理局,HKAA 2.5 01/12/32,87.8,2.5,4.077,1200.00 百万,2022/1/12,发行人将债券的净收益用于其资本支出，包括三跑道系统项目的资本支出和一般公司用途,2031/10/12,产业债,103375,2032/1/12
香港机场管理局,HKAA 2.5 01/12/32,87.8,2.5,4.077,1200.00 百万,2022/1/12,发行人将债券的净收益用于其资本支出，包括三跑道系统项目的资本支出和一般公司用途,2031/10/12,产业债,103376,2032/1/12
香港机场管理局,HKAA 1.75 01/12/27,92.454,1.75,3.628,1000.00 百万,2022/1/12,净收益用于在发行人的可持续融资框架下为符合条件的绿色项目融资或再融资,2026/12/12,产业债,103377,2027/1/12
香港机场管理局,HKAA 1.75 01/12/27,92.454,1.75,3.628,1000.00 百万,2022/1/12,净收益用于在发行人的可持续融资框架下为符合条件的绿色项目融资或再融资,2026/12/12,产业债,103378,2027/1/12
靖江港口集团有限公司,JJHD 2 01/12/25,-,2,-,100.00 百万,2022/1/12,为建设项目融资、补充营运资金和一般公司用途,--,城投债,103380,2025/1/12
国泰君安国际控股有限公司,GUOTJU 0.83 07/12/22,-,0.83,-,460.00 百万,2022/1/12,--,--,金融债,103386,2022/7/12
无锡市锡西新城产业发展集团有限公司,WXXXID 2 01/12/25,-,2,-,100.00 百万,2022/1/12,为建设项目融资和补充营运资金,--,城投债,103387,2025/1/12
无锡市锡西新城产业发展集团有限公司,WXXXID 2 01/12/25,-,2,-,100.00 百万,2022/1/12,为建设项目融资和补充营运资金,--,城投债,103388,2025/1/12
镇江国有投资控股集团有限公司,ZHESTA 1.9 01/11/23,-,1.9,-,150.00 百万,2022/1/12,一般企业用途、运营资本、再融资,--,城投债,103389,2023/1/11
会德丰有限公司,WHEELK 3.3 01/11/25,-,3.3,-,437.00 百万,2022/1/11,--,--,地产债,103366,2025/1/11
恒基兆业地产有限公司,HENLND 1.55 01/11/24,-,1.55,-,550.00 百万,2022/1/11,--,--,地产债,103367,2024/1/11
合生创展集团有限公司,HPDLF 8 01/06/23,81.837,8,68.873,250.00 百万,2022/1/10,再融资及一般公司用途,--,地产债,103256,2023/1/6
国泰君安国际控股有限公司,GUOTJU 1.05 12/16/22,99.456,1.05,2.824,300.00 百万,2022/1/10,一般企业用途,--,金融债,103368,2022/12/16
盐城高新区投资集团有限公司,YCINVE 2 01/10/25,-,2,-,100.00 百万,2022/1/10,一般企业用途、再融资,--,城投债,103369,2025/1/10
东台市东方建设投资发展有限公司,DONDON 1.9 01/06/23,-,1.9,-,77.00 百万,2022/1/7,为一般公司用途,--,城投债,103365,2023/1/6
浙江长兴金融控股集团有限公司,ZJXCAO 1.95 01/06/25,-,1.95,-,98.00 百万,2022/1/6,为绿色债券项目融资，包括(吉利汽车长兴制造基地项目)和碳中性供应链项目，并补充营运资金。,--,城投债,103340,2025/1/6
靖江港口集团有限公司,JJHD 1.95 01/05/25,-,1.95,-,50.00 百万,2022/1/5,一般企业用途、运营资本,--,城投债,103362,2025/1/5
湖州新型城市投资发展集团有限公司,HZZLDE 2.58 01/04/25,96,2.58,4.38,200.00 百万,2022/1/4,资本支出、项目融资,--,城投债,103341,2025/1/4
上坤地产集团有限公司,SUNKWP 13.5 01/02/23,99.625,13.5,14.237,160.20 百万,2022/1/3,--,--,地产债,103364,2023/1/2
巨星医疗控股有限公司,YESTAR 9.5 12/30/26,63.125,9.5,-,197.86 百万,2021/12/30,--,2024/9/15、2025/9/15,产业债,103363,2026/12/30
海宁仰山实业集团有限公司,HNYSSY 1.95 12/29/24,-,1.95,-,150.00 百万,2021/12/29,为集团相关工业园区项目和升级项目提供资金，并补充其营运资金,--,城投债,103339,2024/12/29
南京六合经济技术开发集团有限公司,LNGLTD 1.9 12/27/22,-,1.9,-,98.00 百万,2021/12/28,为现有离岸债务再融资,--,城投债,103333,2022/12/27
西安航空城建设发展(集团)有限公司,XIANAV 6.2 12/28/24,-,6.2,-,66.50 百万,2021/12/28,置换境外存量债务,--,城投债,103338,2024/12/28
肇庆市高要区国有资产经营有限公司,GYSOAO 1.9 12/23/22,-,1.9,-,48.00 百万,2021/12/24,用作运营资本和偿还现有债务,--,城投债,103312,2022/12/23
海盐杭州湾投资发展集团有限公司,HYHZWI 1.95 12/24/24,-,1.95,-,60.00 百万,2021/12/24,为项目建设和补充运营资本,--,城投债,103329,2024/12/24
中国飞机租赁集团控股有限公司,CHNAAR 4.85 12/23/24,94.888,4.85,7.269,100.00 百万,2021/12/23,用于飞机收购、飞机和相关业务的业务扩张、现有借款的再融资以及一般公司用途,--,产业债,103302,2024/12/23
中国银行股份有限公司,BCHINA 0.95 12/23/23,96.618,0.95,3.574,300.00 百万,2021/12/23,一般企业用途,--,金融债,103304,2023/12/23
交通银行股份有限公司,BOCOM 0.85 12/22/23,-,0.85,-,1200.00 百万,2021/12/23,一般企业用途、运营资本,--,金融债,103306,2023/12/22
浙江钱塘江投资开发有限公司,HNJSDV 1.95 12/23/24,-,1.95,-,100.00 百万,2021/12/23,用于项目建设和补充运营资本,--,城投债,103309,2024/12/23
南京六合经济技术开发集团有限公司,LNGLTD 1.9 12/22/22,-,1.9,-,43.00 百万,2021/12/23,用于集团一般企业用途,--,城投债,103313,2022/12/22
山东省商业集团有限公司,SHDCOM 3.5 11/16/24,-,3.5,-,120.00 百万,2021/12/23,为若干离岸债务再融资、发展零售业务和发展离岸业务,--,产业债,103314,2024/11/16
中华人民共和国,PBOCIN 2.5 06/23/22,-,2.5,-,5000.00 百万,2021/12/23,--,--,政府债,103330,2022/6/23
杭州钱塘新区城市发展集团有限公司,CFINBV 3.98 12/22/22,-,3.98,-,100.00 百万,2021/12/23,一般企业用途,--,城投债,103342,2022/12/22
绿城中国控股有限公司,GRNCH 5.95 12/22/24,98.875,5.95,6.473,150.00 百万,2021/12/22,为现有债务再融资,2023/12/22,地产债,103300,2024/12/22
泰州东部新城发展集团有限公司,XININT 1.9 12/21/22,-,1.9,-,65.00 百万,2021/12/22,一般企业用途,--,城投债,103308,2022/12/21
招银国际租赁管理有限公司,CMINLE 0.5 12/22/23,-,0.5,-,30.00 百万,2021/12/22,--,--,金融债,103310,2023/12/22
会德丰有限公司,WHEELK 2.35 03/21/31,-,2.35,-,200.00 百万,2021/12/21,--,--,地产债,103286,2031/3/21
北京市基础设施投资有限公司,BEIJHK 1.6 12/21/24,-,1.6,-,500.00 百万,2021/12/21,--,--,城投债,103287,2024/12/21
中国建设银行股份有限公司,CCB Float 12/21/24,99.407,SOFR+50,-,500.00 百万,2021/12/21,发行票据的净收益将全部或部分用于向参与符合条件的绿色项目的客户以及本行自身的运营活动提供融资和/或再融资,--,金融债,103295,2024/12/21
湖州新型城市投资发展集团有限公司,HZZLDE 4.5 12/21/24,-,4.5,-,200.00 百万,2021/12/21,一般企业用途,--,城投债,103298,2024/12/21
湖州新型城市投资发展集团有限公司,HZZLDE 4.5 12/21/24,-,4.5,-,470.00 百万,2021/12/21,一般企业用途,--,城投债,103299,2024/12/21
无锡市广益建设发展集团有限公司,WXGYGP 1.95 12/21/24,-,1.95,-,150.00 百万,2021/12/21,用于项目建设和流动资金补充,--,城投债,103303,2024/12/21
江苏姜堰经开集团有限公司,TZJYJK 5.17 12/20/24,-,5.17,-,30.00 百万,2021/12/20,运营资本、项目融资,--,城投债,103307,2024/12/20
靖江港口集团有限公司,JJHD 1.95 12/17/24,-,1.95,-,98.00 百万,2021/12/17,为建设项目融资、偿还现有债务、补充营运资金和一般公司用途,--,城投债,103288,2024/12/17
北京燃气蓝天控股有限公司,BGBSP 3.875 07/17/22,-,3.875,-,40.00 百万,2021/12/17,--,--,产业债,103305,2022/7/17
联洋智能控股有限公司,PNASHD 6 06/23/23,-,6,-,46.00 百万,2021/12/17,一般企业用途、运营资本,2022/4/22,产业债,103311,2023/6/23
平度市国有资产经营管理有限公司,PDSOAM 5 12/16/24,-,5,-,200.00 百万,2021/12/16,为项目建设和补充营运资金,--,城投债,103278,2024/12/16
海通国际证券集团有限公司,HTISEC 0.75 12/15/22,98.961,0.75,4.201,100.00 百万,2021/12/16,一般企业用途、运营资本,--,金融债,103280,2022/12/15
国家开发银行,SDBC 1.5 12/16/26,-,1.5,-,770.00 百万,2021/12/16,--,--,金融债,103290,2026/12/16
温州市鹿城区国有控股集团有限公司,WZLCSO 4.1 12/16/24,-,4.1,-,972.00 百万,2021/12/16,用于项目建设和一般运营资本,--,城投债,103296,2024/12/16
会德丰有限公司,WHEELK 2 12/15/26,-,2,-,300.00 百万,2021/12/15,一般企业用途,--,地产债,103225,2026/12/15
光银国际投资有限公司,CEBINT 2 12/15/24,94.191,2,4.685,300.00 百万,2021/12/15,为替换到期的离岸贷款,--,金融债,103257,2024/12/15
黄石市国有资产经营有限公司,HUASST 2.8 11/15/24,-,2.8,-,98.00 百万,2021/12/15,项目建设、在岸债务再融资和补充运营资本,--,城投债,103289,2024/11/15
青岛动车小镇投资集团有限公司,QDHSTI 2.9 12/15/24,-,2.9,-,50.00 百万,2021/12/15,一般企业用途、运营资本,--,城投债,103291,2024/12/15
明阳智慧能源集团股份公司,MINYAN 1.6 12/14/24,-,1.6,-,200.00 百万,2021/12/14,绿色金融框架下，通辽开鲁600MW风电项目的项目建设费用和采购费用,--,产业债,103224,2024/12/14
中信证券股份有限公司,CITICS 0.75 12/13/22,-,0.75,-,750.00 百万,2021/12/14,一般企业用途、运营资本、项目融资、中介机构贷款,--,金融债,103226,2022/12/13
无锡市建设发展投资有限公司,WUXIMU 1.95 12/14/24,93.875,1.95,4.789,300.00 百万,2021/12/14,用于集团绿色框架下的债务再融资,--,城投债,103227,2024/12/14
青岛市即墨区城市旅游开发投资有限公司,JIMOTM 2.9 12/14/24,-,2.9,-,165.00 百万,2021/12/14,为开发集团项目进行融资，并补充集团的营运资本,--,城投债,103279,2024/12/14
中国农业银行股份有限公司,AGRBK 3.09 12/14/22,-,3.09,-,300.00 百万,2021/12/14,--,--,金融债,104121,2022/12/14
国家电力投资集团有限公司,SPICPT 3.45 PERP,96.757,3.45,4.697,1200.00 百万,2021/12/13,根据集团内部融资协议，优先股发行的全部总收益将贷给融资接收方。母公司已同意无条件且不可撤销地担保融资接收方根据集团内融资协议不时向融资提供方支付的所有到期支付款项,2025/5/13、2025/5/14、2025/5/15、2025/5/16、2025/5/17、2025/5/18、2025/5/19、2025/5/20、2025/5/21、2025/5/22,产业债,103215,PERP
海通国际证券集团有限公司,HTISEC 0.65 06/13/22,-,0.65,-,800.00 百万,2021/12/13,--,--,金融债,103216,2022/6/13
交通银行股份有限公司,BOCOM 0.95 12/13/23,-,0.95,-,1200.00 百万,2021/12/13,为运营资本和一般公司用途,--,金融债,103220,2023/12/13
交通银行股份有限公司,BOCOM 3.15 12/13/24,-,3.15,-,1000.00 百万,2021/12/13,运营资本和一般公司用途,--,金融债,103221,2024/12/13
济南轨道交通集团有限公司,JNRWVE 2 12/12/22,-,2,-,100.00 百万,2021/12/13,一般企业用途,--,城投债,103228,2022/12/12
潍坊滨海投资发展有限公司,WFBHIN 5.1 12/12/22,-,5.1,-,80.00 百万,2021/12/13,为偿还现有债务以及一般运营资本,--,城投债,103229,2022/12/12
厦门国贸控股集团有限公司,XMITGH 2.15 12/12/22,-,2.15,-,300.00 百万,2021/12/13,补充营运资本及为集团境内外现有债务再融资,--,城投债,103231,2022/12/12
山东明水国开实业开发有限公司,SDMSGK 1.98 12/13/24,-,1.98,-,13.00 百万,2021/12/13,为补充营运资金,--,城投债,103258,2024/12/13
余姚经济开发区建设投资发展有限公司,YYSCIH 2.5 12/13/24,-,2.5,-,100.00 百万,2021/12/13,为现有离岸债券再融资,--,城投债,103259,2024/12/13
招银国际租赁管理有限公司,CMINLE Float 12/12/22,-,3mL+55,-,60.00 百万,2021/12/13,一般企业用途、再融资,--,金融债,103260,2022/12/12
绿地控股集团有限公司,GRNLGR 7.974 08/10/22,87.25,7.974,193.97,350.00 百万,2021/12/10,主要用于集团对其离岸债务的再融资,--,地产债,103230,2022/8/10
烟台国丰投资控股集团有限公司,YTGFIH 2.2 12/09/24,96.883,2.2,3.63,250.00 百万,2021/12/9,项目建设及流动资金补充,--,城投债,103222,2024/12/9
宝鸡市投资(集团)有限公司,BAJIIV 3.35 12/09/24,-,3.35,-,60.00 百万,2021/12/9,偿还现有离岸债务,--,城投债,103223,2024/12/9
海通国际证券集团有限公司,HTISEC 0.75 12/07/22,99.03,0.75,4.219,100.00 百万,2021/12/8,一般企业用途、运营资本,--,金融债,103202,2022/12/7
宁波南滨集团有限公司,NBNBGC 3.5 12/08/24,-,3.5,-,100.00 百万,2021/12/8,为若干项目融资和额外营运资本,--,城投债,103217,2024/12/8
绿景(中国)地产投资有限公司,LVGEM 6 12/07/22,-,6,-,222.95 百万,2021/12/8,一般企业用途、再融资,--,地产债,103292,2022/12/7
绿景(中国)地产投资有限公司,LVGEM 6 12/07/22,-,6,-,11.50 百万,2021/12/8,一般企业用途、再融资,--,地产债,103293,2022/12/7
绿景(中国)地产投资有限公司,LVGEM 6 12/07/22,-,6,-,1.00 百万,2021/12/8,一般企业用途、再融资,--,地产债,103294,2022/12/7
成都经开国投集团有限公司,CDECST 5.3 12/07/24,98.765,5.3,5.881,500.00 百万,2021/12/7,再融资,--,城投债,103198,2024/12/7
泰州三福重工集团有限公司,TZHVYI 1.9 12/07/24,-,1.9,-,100.00 百万,2021/12/7,补充营运资本和若干投资活动,2024/11/8,产业债,103204,2024/12/7
建德市国有资产经营有限公司,JDSOAM 4.85 12/06/24,-,4.85,-,90.00 百万,2021/12/6,一般企业用途、项目融资、再融资,--,城投债,103196,2024/12/6
青岛开发区投资建设集团有限公司,QDKFTZ 4.6 12/06/24,-,4.6,-,50.00 百万,2021/12/6,运营资本,--,城投债,103197,2024/12/6
铁岭公共资产投资运营集团有限公司,TLPUBL 9.2 12/06/24,-,9.2,-,70.43 百万,2021/12/6,再融资,--,城投债,103199,2024/12/6
铁岭公共资产投资运营集团有限公司,TLPUBL 9.1 12/06/24,-,9.1,-,930.00 百万,2021/12/6,再融资,--,城投债,103200,2024/12/6
平顶山天安煤业股份有限公司,PINGMI 2.8 12/05/22,-,2.8,-,100.00 百万,2021/12/6,补充集团营运资本或偿还集团的银行借款,--,产业债,103201,2022/12/5
南京溧水城市建设集团有限公司,LSHUC 2.45 11/23/22,-,2.45,-,60.00 百万,2021/12/3,一般企业用途,--,城投债,103193,2022/11/23
东方财富信息股份有限公司,EASTMO 2 12/02/24,94.201,2,4.723,300.00 百万,2021/12/2,为集团海外业务的扩展和发展提供资金,--,金融债,103188,2024/12/2
宁波市海曙开发建设投资集团有限公司,NBHSDC 2.2 12/02/24,96.125,2.2,3.999,150.00 百万,2021/12/2,用于项目建设和一般运营资本,--,城投债,103189,2024/12/2
成都交通投资集团有限公司,CDCOMM 2.2 12/01/24,95.375,2.2,4.363,600.00 百万,2021/12/1,为集团现有离岸债务再融资以及为补充集团营运资本,--,城投债,103181,2024/12/1
中国光大银行股份有限公司,CHEVBK 1.27 12/01/24,94.589,1.27,3.779,300.00 百万,2021/12/1,一般资金用途,--,金融债,103190,2024/12/1
国泰君安国际控股有限公司,GUOTJU 0.78 11/29/22,-,0.78,-,30.00 百万,2021/11/30,--,--,金融债,103175,2022/11/29
中华人民共和国(香港特区政府),HKINTL 3 11/30/26,-,3,-,2500.00 百万,2021/11/30,根据发行人不时修订的绿色债券框架下的一个或多个“合格类别”，计划下发行的票据的收益将专门用于这些项目的融资和/或再融资。上述项目被定义为绿色债券框架下的“合格项目”，并将提供环境效益，并支持中国香港特区的可持续发展,--,政府债,103182,2026/11/30
中华人民共和国(香港特区政府),HKINTL 2.8 11/30/24,-,2.8,-,2500.00 百万,2021/11/30,根据发行人不时修订的绿色债券框架下的一个或多个“合格类别”，计划下发行的票据的收益将专门用于这些项目的融资和/或再融资。上述项目被定义为绿色债券框架下的“合格项目”，并将提供环境效益，并支持中国香港特区的可持续发展,--,政府债,103183,2024/11/30
山东能源集团有限公司,YGCZCH 2.9 11/30/24,98.023,2.9,3.818,500.00 百万,2021/11/30,用于一般公司用途，包括偿还债务和补充营运资本,--,产业债,103184,2024/11/30
中集安瑞科控股有限公司,CIMCEH 0 11/30/26,-,0,-,1680.00 百万,2021/11/30,一般企业用途,2024/11/30,产业债,103150,2026/11/30
中国农业银行股份有限公司,AGRBK Float 11/29/24,-,3mBBSW+53,-,500.00 百万,2021/11/29,--,--,金融债,103187,2024/11/29
山东省商业集团有限公司,SHDCOM 7 11/29/24,100.145,7,6.922,275.00 百万,2021/11/29,再融资,--,产业债,103191,2024/11/29
中融国际控股有限公司,ZHNBND 6.8 11/28/22,-,6.8,-,100.00 百万,2021/11/29,一般公司用途和偿还现有债务,--,金融债,103192,2022/11/28
济南产业发展投资集团有限公司,JINIDS 4.5 11/25/22,-,4.5,-,100.00 百万,2021/11/26,用于项目建设、补充运营资本和一般企业用途,--,城投债,103177,2022/11/25
江苏金灌投资发展集团有限公司,JINGUA 1.98 10/26/24,-,1.98,-,50.00 百万,2021/11/26,运营资本、投资、再融资,--,城投债,103178,2024/10/26
中国蒙牛乳业有限公司,CHMEDA 3.08 11/26/26,-,3.08,-,4862.60 百万,2021/11/26,一般企业用途,2022/11/21、2023/11/21、2024/11/21、2025/11/21,产业债,103185,2026/11/26
会德丰有限公司,WHEELK 1.65 11/26/24,-,1.65,-,400.00 百万,2021/11/26,一般企业用途,--,地产债,103158,2024/11/26
会德丰有限公司,WHEELK 2.5 11/26/31,-,2.5,-,200.00 百万,2021/11/26,一般企业用途,--,地产债,103165,2031/11/26
中化香港(集团)有限公司,SINOCH 0.75 11/25/25,-,0.75,-,500.00 百万,2021/11/25,现有债务再融资,2025/10/25,产业债,103161,2025/11/25
天津保税区投资控股集团有限公司,TJFTZI 3 11/24/24,-,3,-,200.00 百万,2021/11/24,为集团现有的离岸债务进行再融资,--,城投债,103168,2024/11/24
岳阳市城市建设投资集团有限公司,YYCCIG 3.48 11/24/26,93.25,3.48,5.273,220.00 百万,2021/11/24,用于岳阳临港高新技术产业开发区创新创业基地二期项目基础设施建设，以及补充集团营运资金。,--,城投债,103169,2026/11/24
江苏科维控股集团有限公司,JSKWHG 1.98 11/24/24,-,1.98,-,83.00 百万,2021/11/24,用于补充在岸和离岸流动资本和项目建设,--,城投债,103170,2024/11/24
江苏科维控股集团有限公司,JSKWHG 1.98 11/24/24,-,1.98,-,80.00 百万,2021/11/24,用于补充在岸和离岸流动资本和项目建设,--,城投债,103172,2024/11/24
淄博市淄川区财金控股有限公司,ZBZCHD 2.9 11/24/24,-,2.9,-,52.00 百万,2021/11/24,项目融资,--,城投债,103180,2024/11/24
国泰君安国际控股有限公司,GUOTJU 0.6 08/24/22,-,0.6,-,150.00 百万,2021/11/24,--,--,金融债,103152,2022/8/24
国泰君安证券股份有限公司,GTJA 1.6 11/24/24,94.613,1.6,4.13,300.00 百万,2021/11/24,为现有债务再融资以及为集团的一般公司用途,--,金融债,103153,2024/11/24
中华人民共和国(香港特区政府),HKINTL 1.75 11/24/31,87.134,1.75,3.381,1000.00 百万,2021/11/24,根据发行人不时修订的绿色债券框架下的一个或多个“合格类别”，计划发行的票据的收益将专门用于这些项目的融资和/或再融资。上述项目被定义为绿色债券框架下的“合格项目”，并将提供环境效益，并支持中国香港特区的可持续发展,--,政府债,103155,2031/11/24
中华人民共和国(香港特区政府),HKINTL 1 11/24/41,-,1,-,500.00 百万,2021/11/24,根据发行人不时修订的绿色债券框架下的一个或多个“合格类别”，计划下发行的票据的收益将专门用于这些项目的融资和/或再融资。上述项目被定义为绿色债券框架下的“合格项目”，并将提供环境效益，并支持中国香港特区的可持续发展,--,政府债,103156,2041/11/24
中华人民共和国(香港特区政府),HKINTL 0 11/24/26,-,0,-,1250.00 百万,2021/11/24,根据发行人不时修订的绿色债券框架下的一个或多个“合格类别”，计划下发行的票据的收益将专门用于这些项目的融资和/或再融资。上述项目被定义为绿色债券框架下的“合格项目”，并将提供环境效益，并支持中国香港特区的可持续发展,--,政府债,103157,2026/11/24
国家开发银行,SDBC 1.5 11/24/26,-,1.5,-,770.00 百万,2021/11/24,一般企业用途、运营资本,--,金融债,103159,2026/11/24
中化香港(集团)有限公司,SINOCH 2.25 11/24/26,90.679,2.25,4.695,500.00 百万,2021/11/24,为现有在岸债务再融资,2026/10/24,产业债,103162,2026/11/24
中化香港(集团)有限公司,SINOCH 1.5 11/24/24,94.051,1.5,4.304,300.00 百万,2021/11/24,为现有在岸债务再融资,2024/10/24,产业债,103163,2024/11/24
台州市国有资产投资集团有限公司,TZSOAI 2.02 11/24/24,-,2.02,-,90.00 百万,2021/11/24,发展发行人的业务和其他一般营运资金用途,--,城投债,103164,2024/11/24
雅居乐集团控股有限公司,AGILE 7 11/24/26,-,7,-,2418.00 百万,2021/11/24,用作于一年内到期的若干现有中长期离岸债务再融资。,2024/11/24,地产债,103166,2026/11/24
哔哩哔哩股份有限公司,BILI 0.5 12/01/26,68.519,0.5,-,1600.00 百万,2021/11/23,一般企业用途、可持续发展债券/贷款,2024/12/1,产业债,103171,2026/12/1
中华人民共和国,PBOCIN 2.75 11/23/22,-,2.75,-,15000.00 百万,2021/11/23,--,--,政府债,103173,2022/11/23
中华人民共和国,PBOCIN 2.59 02/22/22,-,2.59,-,10000.00 百万,2021/11/23,--,--,政府债,103174,2022/2/22
中国长城资产(国际)控股有限公司,GRWALL 2.875 11/23/26,81.96,2.875,7.965,300.00 百万,2021/11/23,再融资,--,金融债,103148,2026/11/23
邳州市交通控股集团有限公司,PZHCOM 5.4 11/22/22,-,5.4,-,56.00 百万,2021/11/23,一般企业用途,--,城投债,103160,2022/11/22
阳光城集团股份有限公司,SUNSHI 10.25 09/15/22,5.968,10.25,-,669.85 百万,2021/11/23,--,2021/11/23,地产债,103167,2022/9/15
惠州亿纬锂能股份有限公司,EVEENE 0.75 11/22/26,80.612,0.75,5.99,350.00 百万,2021/11/22,一般企业用途、运营资本,2024/11/22,产业债,103179,2026/11/22
中华人民共和国(香港特区政府),HKGB 0.31 11/22/23,-,0.31,-,1200.00 百万,2021/11/22,--,--,政府债,103127,2023/11/22
国家开发投资集团有限公司,SDIC 1.875 11/22/26,92.24,1.875,3.875,300.00 百万,2021/11/22,用于海外项目建设和一般公司用途,2026/10/22,金融债,103146,2026/11/22
肥城市城市资产经营集团有限公司,FECHAT 4.5 11/21/22,-,4.5,-,50.00 百万,2021/11/22,--,--,城投债,103151,2022/11/21
济南高新控股集团有限公司,JNHITE 2.8 11/22/24,95.939,2.8,4.728,250.00 百万,2021/11/22,偿还发行人2021年12月到期的离岸债券,--,城投债,103154,2024/11/22
恒基兆业地产有限公司,HENLND 3.6 11/19/23,-,3.6,-,200.00 百万,2021/11/19,公司间贷款,--,地产债,103126,2023/11/19
会德丰有限公司,WHEELK 2.05 11/19/26,-,2.05,-,500.00 百万,2021/11/19,--,--,地产债,103132,2026/11/19
恒基兆业地产有限公司,HENLND 3.6 11/19/23,-,3.6,-,732.00 百万,2021/11/19,--,--,地产债,103136,2023/11/19
绍兴市上虞城市建设集团有限公司,SHYUCD 3.3 11/19/26,94.625,3.3,4.714,240.00 百万,2021/11/19,根据可持续融资框架对集团债务进行再融资,--,城投债,103149,2026/11/19
中华人民共和国(香港特区政府),GBHK Float 11/18/22,-,O/N HONIA FLAT,-,1000.00 百万,2021/11/18,--,--,政府债,103108,2022/11/18
泰安市泰山财金投资集团有限公司,TAIFIN 3.5 11/18/24,99.167,3.5,3.891,300.00 百万,2021/11/18,用于债务再融资和项目建设,--,城投债,103131,2024/11/18
常德市经济建设投资集团有限公司,CHAECO 5 11/17/22,-,5,-,68.00 百万,2021/11/18,运营资本、项目融资、再融资,--,城投债,103137,2022/11/17
菏泽城投控股集团有限公司,HZCCIH 4.55 11/17/22,-,4.55,-,119.00 百万,2021/11/18,净收益将汇往境内，用于子公司投资、项目投资、现有债务再融资和一般公司用途,--,城投债,103144,2022/11/17
宜昌高新投资开发有限公司,YCGXIV 5 11/18/24,-,5,-,100.00 百万,2021/11/18,现有离岸债务再融资,--,城投债,103145,2024/11/18
兖矿能源集团股份有限公司,YZCOAL 2.9 11/18/24,96.286,2.9,4.67,300.00 百万,2021/11/18,一般企业用途、运营资本、再融资,--,产业债,103147,2024/11/18
中国建设银行股份有限公司,CCB 3 11/16/22,-,3,-,200.00 百万,2021/11/17,--,--,金融债,104098,2022/11/16
中国航空技术国际控股有限公司,CATIC 2.5 11/17/26,90.982,2.5,4.885,500.00 百万,2021/11/17,为现有债务再融资,2026/10/17,产业债,103111,2026/11/17
顺丰控股股份有限公司,SFHOLD 3.125 11/17/31,84.637,3.125,5.245,800.00 百万,2021/11/17,现有债务再融资,--,产业债,103112,2031/11/17
顺丰控股股份有限公司,SFHOLD 2.375 11/17/26,92.183,2.375,4.421,800.00 百万,2021/11/17,现有债务再融资,--,产业债,103113,2026/11/17
顺丰控股股份有限公司,SFHOLD 3 11/17/28,89.863,3,4.907,300.00 百万,2021/11/17,现有债务再融资,--,产业债,103114,2028/11/17
信银(香港)投资有限公司,CNCBHK 1.75 11/17/24,93.934,1.75,4.642,500.00 百万,2021/11/17,一般公司用途、再融资,--,金融债,103119,2024/11/17
中华人民共和国,CHINA 0 11/17/24,-,0,-,1500.00 百万,2021/11/17,净收益将由财政部用于一般政府用途,--,政府债,103122,2024/11/17
中华人民共和国,CHINA 0.125 11/17/28,-,0.125,-,1500.00 百万,2021/11/17,净收益将由财政部用于一般政府用途,--,政府债,103123,2028/11/17
中华人民共和国,CHINA 0.625 11/17/33,-,0.625,-,1000.00 百万,2021/11/17,净收益将由财政部用于一般政府用途,--,政府债,103124,2033/11/17
中国建设银行股份有限公司,CCB 3 11/15/22,-,3,-,200.00 百万,2021/11/16,--,--,金融债,104193,2022/11/15
济南历下控股集团有限公司,JINLIX 3.4 11/16/24,96.375,3.4,5.142,250.00 百万,2021/11/16,用于中国境内的明湖国际细胞药物开发项目、明湖国际生物制药生产基地项目、济南历下区综合医疗中心B部分项目和槿椿・泺园项目建设。,--,城投债,103115,2024/11/16
武汉金融控股(集团)有限公司,WUECDE 3.4 11/16/24,95.708,3.4,5.472,450.00 百万,2021/11/16,偿还现有离岸债务和在国内从事项目投资,--,城投债,103116,2024/11/16
威海市文登区蓝海投资开发有限公司,WHWDLH 6.5 11/15/22,-,6.5,-,85.00 百万,2021/11/16,为偿还发行人现有的WHWDLH 6.8 11/24/21，发行规模为8000万美元、息票率为6.8%、于2021年11月24日到期的有担保债券,--,城投债,103121,2022/11/15
武汉当代科技产业集团股份有限公司,DANDAI 9.25 11/15/22,99.414,9.25,10.992,150.00 百万,2021/11/16,一般企业用途、运营资本、再融资,--,产业债,103135,2022/11/15
恒基兆业地产有限公司,HENLND 2.5 11/15/27,90.811,2.5,4.482,30.00 百万,2021/11/15,一般企业用途,--,地产债,103106,2027/11/15
国泰君安国际控股有限公司,GUOTJU 0.65 05/15/22,100,0.65,-,100.00 百万,2021/11/15,--,--,金融债,103107,2022/5/15
郑州地铁集团有限公司,ZZMTRG 1.915 11/15/24,95.491,1.915,4.056,500.00 百万,2021/11/15,为现有离岸债务再融资,--,城投债,103117,2024/11/15
港龙中国地产集团有限公司,GNGLNG 13.5 11/11/22,99.471,13.5,15.459,158.00 百万,2021/11/12,再融资和一般企业用途/运营资本,--,地产债,103101,2022/11/11
港华智慧能源有限公司,PANVA 3.4 11/12/24,-,3.4,-,750.00 百万,2021/11/12,一般企业用途、再融资,--,产业债,103102,2024/11/12
浦江县国有资本投资集团有限公司,PJZBTZ 2 11/12/24,-,2,-,50.00 百万,2021/11/12,用于基础设施建设和补充集团营运资金,--,城投债,103105,2024/11/12
苏州工业园区国有资本投资运营控股有限公司,SIPPRO 3.6 11/12/31,-,3.6,-,1000.00 百万,2021/11/12,运营资本、项目融资,2026/11/12,城投债,103125,2031/11/12
恒基兆业地产有限公司,HENLND 1.4 11/11/23,-,1.4,-,239.00 百万,2021/11/11,--,--,地产债,103103,2023/11/11
三盛控股(集团)有限公司,SSHGHK 12.5 11/10/22,-,12.5,-,70.00 百万,2021/11/11,一般企业用途、再融资,--,地产债,103118,2022/11/10
渤海银行股份有限公司,BOHAIB 1.5 11/10/24,93.008,1.5,4.876,300.00 百万,2021/11/10,用作运营资本,--,金融债,103095,2024/11/10
江苏方洋集团有限公司,FANGYA 1.98 11/10/24,100.25,1.98,1.863,150.00 百万,2021/11/10,偿还集团一年内到期的现有离岸债务,--,城投债,103096,2024/11/10
济南城市建设集团有限公司,JNUCGC 2.3 11/10/24,96.587,2.3,3.927,500.00 百万,2021/11/10,项目建设、偿还境内债务、补充运营资本,--,城投债,103097,2024/11/10
丽新发展有限公司,LASUDE 4.9 11/10/26,-,4.9,-,180.00 百万,2021/11/10,--,--,地产债,103099,2026/11/10
浙江省新昌县投资发展集团有限公司,ZJXCID 3.6 11/10/24,-,3.6,-,200.00 百万,2021/11/10,项目融资、再融资,--,城投债,103104,2024/11/10
中国银行股份有限公司,BCHINA 1.75 11/09/26,92.356,1.75,3.73,600.00 百万,2021/11/9,发行票据所得款项净额将用于为中银投资绿色债券管理声明中定义的合格绿色项目融资和/或再融资,--,金融债,103093,2026/11/9
国家电力投资集团有限公司,SPICPF 3.38 PERP,97.214,3.38,4.722,900.00 百万,2021/11/9,根据集团内部融资协议，优先股发行的全部总收益将贷给融资接收方。母公司已同意无条件且不可撤销地担保融资接收方根据集团内融资协议不时向融资提供方支付的所有到期支付款项,2024/10/9、2024/10/10、2024/10/11、2024/10/12、2024/10/13、2024/10/14、2024/10/15、2024/10/16、2024/10/17,产业债,103094,PERP
丽新发展有限公司,LASUDE 5.25 02/09/29,-,5.25,-,205.00 百万,2021/11/9,一般企业用途,--,地产债,103098,2029/2/9
中国建设银行股份有限公司,CCB 3 11/08/22,-,3,-,200.00 百万,2021/11/9,--,--,金融债,104144,2022/11/8
云南省交通投资建设集团有限公司,YNHIWA 3.8 11/05/26,-,3.8,-,100.00 百万,2021/11/5,一般企业用途,--,城投债,103091,2026/11/5
江苏筑富实业投资有限公司,RGYINT 2.2 11/04/22,-,2.2,-,33.00 百万,2021/11/5,一般企业用途、再融资,--,城投债,103092,2022/11/4
陕西省西咸新区沣西新城开发建设(集团)有限公司,SXXXFX 2.55 11/04/24,-,2.55,-,100.00 百万,2021/11/4,对一年内到期的中长期现有境外债务进行再融资,--,城投债,103088,2024/11/4
舟山海城建设投资集团有限公司,ZSHCCI 2.1 11/04/24,-,2.1,-,100.00 百万,2021/11/4,为离岸债务再融资,--,城投债,103089,2024/11/4
南京扬子国资投资集团有限责任公司,NJYZSO 1.98 11/02/22,99.675,1.98,3.715,280.00 百万,2021/11/3,一般公司用途和债务再融资,--,城投债,103080,2022/11/2
中国信达资产管理股份有限公司,CCAMCL 4.4 PERP,90.683,4.4,7.038,1700.00 百万,2021/11/3,用于补充公司的AT1资本,2026/11/3、2027/5/3、2027/11/3、2028/5/3、2028/11/3、2029/5/3、2029/11/3、2030/5/3、2030/11/3、2031/5/3,金融债,103081,PERP
武汉地铁集团有限公司,WHMTR 1.58 11/03/24,94.24,1.58,4.366,400.00 百万,2021/11/3,对符合条件的绿色项目和/或社会项目进行融资和/或再融资,--,城投债,103082,2024/11/3
世茂服务控股有限公司,SHIMHD 2.25 10/31/22,-,2.25,-,3110.00 百万,2021/11/2,收购融资、一般企业用途、运营资本,--,地产债,103070,2022/10/31
工银国际租赁财务有限公司,ICBCIL 1.625 11/02/24,94.644,1.625,4.214,600.00 百万,2021/11/2,为普通交易中的资产收购、再融资和其他一般公司用途进行融资,--,金融债,103072,2024/11/2
工银国际租赁财务有限公司,ICBCIL 2.25 11/02/26,92.562,2.25,4.205,750.00 百万,2021/11/2,分配或指定用于符合公司绿色融资框架的合格风电项目的再融资,--,金融债,103073,2026/11/2
大新银行有限公司,DAHSIN 3 11/02/31,92.535,3,4.997,300.00 百万,2021/11/2,一般银行及企业用途,2026/11/2、2027/5/2、2027/11/2、2028/5/2、2028/11/2、2029/5/2、2029/11/2、2030/5/2、2030/11/2、2031/5/2,金融债,103075,2031/11/2
中国农业发展银行,ADBCH 3.05 11/02/26,-,3.05,-,1700.00 百万,2021/11/2,为一般信贷业务、营运资金和一般公司用途提供资金,--,金融债,103077,2026/11/2
中国农业发展银行,ADBCH 3.35 11/02/31,-,3.35,-,550.00 百万,2021/11/2,为一般信贷业务、营运资金和一般公司用途提供资金,--,金融债,103078,2031/11/2
中国农业发展银行,ADBCH 2.9 11/02/24,-,2.9,-,1750.00 百万,2021/11/2,为一般信贷业务、营运资金和一般公司用途提供资金,--,金融债,103079,2024/11/2
中国银行股份有限公司,BCHINA 1 11/02/24,94.31,1,3.733,300.00 百万,2021/11/2,将用于为中国银行可持续发展再挂钩债券管理声明中定义的符合条件的可持续发展挂钩贷款组合提供融资和/或再融资,--,金融债,103083,2024/11/2
长江和记实业有限公司,CKHH 0.75 11/02/29,-,0.75,-,500.00 百万,2021/11/2,为若干债务进行再融资和一般公司用途,2029/8/2,产业债,103084,2029/11/2
长江和记实业有限公司,CKHH 1 11/02/33,-,1,-,500.00 百万,2021/11/2,根据担保人的可持续融资框架，净收益(或其等值金额)为全部或部分资产、项目、投资及其他相关和支持性支出融资或再融资,2033/8/2,产业债,103085,2033/11/2
东亚银行有限公司,BNKEA 1.37 11/01/24,95.83,1.37,3.376,20.00 百万,2021/11/1,--,--,金融债,103736,2024/11/1
湖州南浔旅游投资发展集团有限公司,HZHNAX 2 11/01/24,-,2,-,43.00 百万,2021/11/1,为项目建设融资、补充营运资本,--,城投债,103069,2024/11/1
中国工商银行股份有限公司,ICBCAS 3 10/31/22,-,3,-,200.00 百万,2021/11/1,--,--,金融债,104108,2022/10/31
西安航天城市发展控股集团有限公司,XACDVE 3.5 10/29/24,-,3.5,-,48.00 百万,2021/10/29,境内项目建设、补充营运资金以及一般企业用途,--,城投债,103066,2024/10/29
重庆市南部新城产业投资集团有限公司,CQNXCT 5.45 10/29/24,100.79,5.45,5.059,200.00 百万,2021/10/29,项目建设、营运资本补充和离岸债务再融资,--,城投债,103067,2024/10/29
南京六合经济技术开发集团有限公司,LNGLTD 1.95 10/28/22,-,1.95,-,43.00 百万,2021/10/29,补充集团营运资金和偿还海外债务,--,城投债,103074,2022/10/28
宿州市工业投资集团有限公司,SZIIGC 2.7 10/29/24,-,2.7,-,150.00 百万,2021/10/29,--,--,城投债,103076,2024/10/29
成都高新投资集团有限公司,CDHIIN 2.7 10/28/26,91.503,2.7,4.978,300.00 百万,2021/10/28,为一年内到期的离岸债务进行再融资,--,城投债,103037,2026/10/28
湖州市城市投资发展集团有限公司,HZCONI 2.95 10/28/26,92.157,2.95,5.056,200.00 百万,2021/10/28,债券发行的净收益将用于补充营运资本和一般公司用途,--,城投债,103056,2026/10/28
中国工商银行股份有限公司,ICBCAS 1.625 10/28/26,92.455,1.625,3.586,1000.00 百万,2021/10/28,根据工商银行绿色债券框架，为符合条件的绿色资产提供融资和/或再融资,--,金融债,103059,2026/10/28
中国工商银行股份有限公司,ICBCAS 1 10/28/24,94.499,1,3.653,1050.00 百万,2021/10/28,根据工商银行绿色债券框架，为符合条件的绿色资产提供融资/或再融资,--,金融债,103060,2024/10/28
中国工商银行股份有限公司,ICBCAS 0.125 10/28/24,-,0.125,-,500.00 百万,2021/10/28,为符合工商银行《绿色债券框架》规定的合格绿色资产提供融资和/或再融资,--,金融债,103061,2024/10/28
中国工商银行股份有限公司,ICBCAS 0.6 10/28/23,-,0.6,-,2000.00 百万,2021/10/28,根据工商银行绿色债券框架，为符合条件的绿色资产提供融资/或再融资,--,金融债,103062,2023/10/28
中国工商银行股份有限公司,ICBCAS 1.625 12/28/25,-,1.625,-,250.00 百万,2021/10/28,根据工商银行绿色债券框架，为符合条件的绿色资产提供融资和/或再融资,--,金融债,103063,2025/12/28
河北顺德投资集团有限公司,HBSNDI 2 10/28/24,95.505,2,4.179,75.00 百万,2021/10/28,补充发行人的营运资金，并为其现有债务再融资,--,城投债,103068,2024/10/28
大发地产集团有限公司,DAFAPG 13.5 04/28/23,7.25,13.5,-,100.00 百万,2021/10/28,再融资,--,地产债,103071,2023/4/28
中国工商银行股份有限公司,ICBCAS 3 10/27/22,-,3,-,100.00 百万,2021/10/28,--,--,金融债,104184,2022/10/27
领展房地产投资信托基金,LINREI 3.25 10/27/24,-,3.25,-,460.00 百万,2021/10/27,--,--,地产债,103038,2024/10/27
湖南湘江新区发展集团有限公司,HUXJDP 2.65 10/27/26,91.375,2.65,4.963,330.00 百万,2021/10/27,一般营运资本、投资活动和现有债务的再融资,--,城投债,103052,2026/10/27
华鲁控股集团有限公司,HUALUG 2.2 10/27/26,90.375,2.2,4.77,300.00 百万,2021/10/27,在岸项目建设、离岸业务发展、离岸债务再融资和补充营运资本,--,城投债,103053,2026/10/27
国泰君安国际控股有限公司,GUOTJU 0.5 04/27/22,-,0.5,-,400.00 百万,2021/10/27,--,--,金融债,103064,2022/4/27
中华人民共和国,CHINA 0.75 10/26/24,94.813,0.75,3.241,1000.00 百万,2021/10/26,财政部拟将销售本次国债的所得款项净额用作一般政府用途,--,政府债,103044,2024/10/26
中华人民共和国,CHINA 0.75 10/26/24,94.813,0.75,3.241,1000.00 百万,2021/10/26,财政部拟将销售本次国债的所得款项净额用作一般政府用途,--,政府债,103045,2024/10/26
中华人民共和国,CHINA 1.75 10/26/31,89.43,1.75,3.081,1000.00 百万,2021/10/26,财政部拟将销售本次国债的所得款项净额用作一般政府用途,--,政府债,103046,2031/10/26
中华人民共和国,CHINA 1.75 10/26/31,89.43,1.75,3.081,1000.00 百万,2021/10/26,财政部拟将销售本次国债的所得款项净额用作一般政府用途,--,政府债,103047,2031/10/26
中华人民共和国,CHINA 1.25 10/26/26,92.641,1.25,3.146,1500.00 百万,2021/10/26,财政部拟将销售本次国债的所得款项净额用作一般政府用途,--,政府债,103048,2026/10/26
中华人民共和国,CHINA 1.25 10/26/26,92.641,1.25,3.146,1500.00 百万,2021/10/26,财政部拟将销售本次国债的所得款项净额用作一般政府用途,--,政府债,103049,2026/10/26
中华人民共和国,CHINA 2.5 10/26/51,76.823,2.5,3.825,500.00 百万,2021/10/26,财政部拟将销售本次国债的所得款项净额用作一般政府用途,--,政府债,103050,2051/10/26
中华人民共和国,CHINA 2.5 10/26/51,76.823,2.5,3.825,500.00 百万,2021/10/26,财政部拟将销售本次国债的所得款项净额用作一般政府用途,--,政府债,103051,2051/10/26
远洋资本控股有限公司,SINOCL 6 10/25/22,100.004,6,5.859,350.00 百万,2021/10/26,再融资以及瑞喜创投有限公司和其子公司的一般企业用途,--,地产债,103054,2022/10/25
肇庆市国联投资控股有限公司,ZQGLIH 2.68 10/26/24,96.75,2.68,4.147,300.00 百万,2021/10/26,根据可持续金融框架使用,--,城投债,103057,2024/10/26
远东宏信有限公司,FRESHK 4.25 10/26/26,86.373,4.25,8.169,300.00 百万,2021/10/26,用于营运资金和一般公司用途,--,金融债,103058,2026/10/26
宁海县城投集团有限公司,NIHACA 3.3 10/26/24,-,3.3,-,100.00 百万,2021/10/26,运营资本、再融资,--,城投债,103065,2024/10/26
国泰君安国际控股有限公司,GUOTJU 0.5 04/25/22,-,0.5,-,400.00 百万,2021/10/25,--,--,金融债,103039,2022/4/25
国泰君安国际控股有限公司,GUOTJU 0.6 07/25/22,-,0.6,-,400.00 百万,2021/10/25,--,--,金融债,103040,2022/7/25
南京溧水经济技术开发集团有限公司,LSETID 1.95 10/24/22,-,1.95,-,67.00 百万,2021/10/25,再融资,--,城投债,103055,2022/10/24
无锡惠山高科有限公司,WXHSHT 3.8 10/21/22,-,3.8,-,45.00 百万,2021/10/22,一般企业用途,--,城投债,103032,2022/10/21
如东县金鑫交通工程建设投资有限公司,RUDOTR 2.68 10/22/24,-,2.68,-,80.00 百万,2021/10/22,--,--,城投债,103041,2024/10/22
山高控股集团有限公司,CNSHAN 2.8 10/21/22,-,2.8,-,40.00 百万,2021/10/22,一般企业用途、投资,2022/4/22,城投债,103042,2022/10/21
山高控股集团有限公司,CNSHAN 2.8 10/21/22,-,2.8,-,20.00 百万,2021/10/22,一般企业用途、投资,2022/1/22、2022/4/22、2022/7/22,城投债,103043,2022/10/21
Pearl Holding III Limited,PRLHOL 9 10/22/25,-,9,-,66.50 百万,2021/10/22,--,2021/10/22、2022/10/22、2023/10/22、2024/10/22,产业债,103086,2025/10/22
Pearl Holding III Limited,PRLHOL 9 10/22/25,-,9,-,66.50 百万,2021/10/22,--,2021/10/22、2022/10/22、2023/10/22、2024/10/22,产业债,103087,2025/10/22
领展房地产投资信托基金,LINREI 3 10/21/24,-,3,-,300.00 百万,2021/10/21,--,--,地产债,103026,2024/10/21
浙江湖州南浔经济建设开发有限公司,ZJHZNX 2.03 10/20/24,-,2.03,-,48.00 百万,2021/10/20,一般企业用途、运营资本,--,城投债,103005,2024/10/20
领展房地产投资信托基金,LINREI 2.23 10/07/31,-,2.23,-,782.00 百万,2021/10/20,--,--,地产债,103014,2031/10/7
南京江宁经济技术开发集团有限公司,JNJKOS 2.9 10/19/22,99.768,2.9,4.464,210.00 百万,2021/10/20,用于再融资和一般公司用途,--,城投债,103021,2022/10/19
北京市基础设施投资有限公司,BEIJHK 1.35 10/20/24,94.602,1.35,3.99,400.00 百万,2021/10/20,为现有债务再融资,--,城投债,103022,2024/10/20
中华人民共和国广东省人民政府,GUANGD 2.68 10/20/24,-,2.68,-,2200.00 百万,2021/10/20,一般政府用途,--,政府债,103024,2024/10/20
上海地产(集团)有限公司,SHLANZ 3.7 10/20/24,-,3.7,-,750.00 百万,2021/10/20,项目融资,--,城投债,103031,2024/10/20
友邦保险控股有限公司,AIA 3 10/19/51,-,3,-,105.00 百万,2021/10/19,--,2041/10/19、2042/4/19、2042/10/19、2043/4/19、2043/10/19、2044/4/19、2044/10/19、2045/4/19、2045/10/19,金融债,103015,2051/10/19
中华人民共和国广东省深圳市人民政府,SHENZH 2.9 10/19/26,-,2.9,-,2400.00 百万,2021/10/19,所得款项净额根据绿色金融框架用于水治理项目和海绵城市相关项目,--,政府债,103016,2026/10/19
中华人民共和国广东省深圳市人民政府,SHENZH 2.6 10/19/23,-,2.6,-,1100.00 百万,2021/10/19,所得款项净额用作一般政府用途,--,政府债,103017,2023/10/19
中华人民共和国广东省深圳市人民政府,SHENZH 2.7 10/19/24,-,2.7,-,1500.00 百万,2021/10/19,所得款项净额根据绿色金融框架用于清洁交通项目,--,政府债,103018,2024/10/19
东风汽车集团股份有限公司,DONFEN 0.425 10/19/24,-,0.425,-,725.00 百万,2021/10/19,为现有债务再融资和一般公司用途,2024/9/19,产业债,103025,2024/10/19
恒基兆业地产有限公司,HENLND 1 10/18/23,-,1,-,300.00 百万,2021/10/18,--,--,地产债,103019,2023/10/18
诸暨市国有资产经营有限公司,ZJSOAM 3.2 10/18/24,96.971,3.2,4.697,520.00 百万,2021/10/18,为离岸债务再融资,--,城投债,103023,2024/10/18
成都市羊安新城开发建设有限公司,YANNEW 1.9 10/15/24,-,1.9,-,35.00 百万,2021/10/15,补充运营资本,--,城投债,102983,2024/10/15
领展房地产投资信托基金,LINREI 1.48 10/15/26,-,1.48,-,800.00 百万,2021/10/15,一般企业用途,--,地产债,103006,2026/10/15
泰州海陵城市发展集团有限公司,TAIHAI 2 10/14/22,-,2,-,33.00 百万,2021/10/15,补充运营资本,--,城投债,103011,2022/10/14
宜宾市新兴产业投资集团有限公司,YISTAS 2.6 09/15/24,-,2.6,-,97.00 百万,2021/10/15,为现有国内债务再融资和补充运营资本,--,城投债,103012,2024/9/15
鑫苑置业有限公司,XIN 14.2 10/15/23,10.2,14.2,412.435,205.40 百万,2021/10/15,一般企业用途,--,地产债,103027,2023/10/15
国泰君安国际控股有限公司,GUOTJU 0.5 07/14/22,100,0.5,-,65.00 百万,2021/10/15,一般企业用途,--,金融债,103361,2022/7/14
延安新区投资发展(集团)有限公司,YNINVD 5 10/12/22,-,5,-,100.00 百万,2021/10/13,发行人的一般公司用途，包括债务再融资、项目开发融资和补充营运资本,--,城投债,103004,2022/10/12
赣州城市投资控股集团有限责任公司,GZUIHG 3 10/12/24,97.187,3,4.393,150.00 百万,2021/10/12,用于项目建设和补充营运资金,--,城投债,102984,2024/10/12
粤港湾控股有限公司,HYDOO 13.85 10/12/23,31.5,13.85,168.008,277.22 百万,2021/10/12,再融资,--,地产债,103013,2023/10/12
中航国际租赁有限公司,AVIILC 1.65 10/08/24,94.197,1.65,4.552,300.00 百万,2021/10/8,用于债务置换和为租赁项目提供融资,--,产业债,102978,2024/10/8
成都兴城投资集团有限公司,CHDXCH 2.375 10/08/26,91.537,2.375,4.655,300.00 百万,2021/10/8,根据《绿色融资框架》，用于海外再融资以支持若干符合条件的绿色项目,--,城投债,102979,2026/10/8
江苏叠石桥家纺产业集团有限公司,JSDSQI 2.04 10/08/24,-,2.04,-,100.00 百万,2021/10/8,运营资本、再融资,--,产业债,102985,2024/10/8
海伦堡中国控股有限公司,HLBCNH 11 10/08/23,31.71,11,158.672,270.00 百万,2021/10/8,--,--,地产债,103003,2023/10/8
国泰君安国际控股有限公司,GUOTJU 0.57 10/03/22,99.761,0.57,2.797,50.00 百万,2021/10/4,一般企业用途,--,金融债,102956,2022/10/3
长江实业集团有限公司,CKPH 3.38 PERP,-,3.38,-,300.00 百万,2021/9/30,用于担保人及其子公司的一般企业用途,2024/9/30,地产债,102945,PERP
淮北市建投控股集团有限公司,HBCITY 2.75 09/30/24,100.125,2.75,2.701,300.00 百万,2021/9/30,偿还现有债务,--,城投债,102957,2024/9/30
江苏悦达集团有限公司,JIANYU 1.95 09/28/22,-,1.95,-,90.00 百万,2021/9/29,再融资,--,产业债,102946,2022/9/28
中国银行股份有限公司,BCHINA 0.75 09/29/24,93.802,0.75,3.858,300.00 百万,2021/9/29,为《中国银行可持续发展类债券管理声明》中定义的合格绿色项目融资和/或再融资,--,金融债,102958,2024/9/29
中国银行股份有限公司,BCHINA 2.75 09/29/23,-,2.75,-,1000.00 百万,2021/9/29,为《中国银行可持续发展类债券管理声明》中定义的生物多样性相关合格绿色项目提供融资和/或再融资。,--,金融债,102959,2023/9/29
中国建设银行股份有限公司,CCB 1.5 09/29/26,91.56,1.5,3.742,700.00 百万,2021/9/29,用于再融资和一般企业用途,--,金融债,102960,2026/9/29
中国银行股份有限公司,BCHINA 0.6 09/29/23,-,0.6,-,1000.00 百万,2021/9/29,为《中国银行可持续发展类债券管理声明》中定义的生物多样性相关合格绿色项目提供融资和/或再融资。,--,金融债,102961,2023/9/29
甘肃省电力投资集团有限责任公司,GSELEC 3.7 09/29/24,95.085,3.7,6.237,300.00 百万,2021/9/29,发行债券的净收益将用于为若干在岸债务进行再融资、营运资本和其他一般公司用途,--,城投债,102974,2024/9/29
恒隆地产有限公司,HLPPY 2 09/28/28,-,2,-,50.00 百万,2021/9/28,绿色债券/贷款,--,地产债,102930,2028/9/28
新湖中宝股份有限公司,XINHUZ 11 09/28/24,88.642,11,17.71,500.00 百万,2021/9/28,为现有一年内到期的中长期离岸债务再融资,2023/9/28,地产债,102949,2024/9/28
景瑞控股有限公司,JINGRU 12 01/28/24,6.583,12,-,165.00 百万,2021/9/28,为其现有债务再融资,--,地产债,102962,2024/1/28
武汉当代科技产业集团股份有限公司,DANDAI 9 03/28/22,-,9,-,20.50 百万,2021/9/28,--,--,产业债,102975,2022/3/28
中华人民共和国,PBOCIN 2.5 03/29/22,-,2.5,-,5000.00 百万,2021/9/28,--,--,政府债,102976,2022/3/29
江西正邦科技股份有限公司,ZHBTCH 1.85 09/28/24,-,1.85,-,60.00 百万,2021/9/28,再融资,--,产业债,102977,2024/9/28
交银租赁管理香港有限公司,BCLMHK 1.07 09/27/24,-,1.07,-,775.00 百万,2021/9/27,--,--,金融债,102931,2024/9/27
潍坊市城市建设发展投资集团有限公司,WFURCD 2.6 09/27/24,95.359,2.6,4.965,400.00 百万,2021/9/27,项目投资、补充集团营运资本及偿还集团境外债务,--,城投债,102942,2024/9/27
泰州东方中国医药城控股集团有限公司,TZOCMC 6.3 09/27/24,-,6.3,-,50.00 百万,2021/9/27,运营资本、再融资,--,城投债,102963,2024/9/27
中华人民共和国,CGB 2.41 09/27/23,-,2.41,-,12500.00 百万,2021/9/27,--,--,政府债,102964,2023/9/27
中华人民共和国,CGB 2.5 09/27/26,-,2.5,-,4000.00 百万,2021/9/27,--,--,政府债,102965,2026/9/27
陕西旅游集团有限公司,SXTOUR 3 09/24/24,-,3,-,80.00 百万,2021/9/24,债券发行所得款项将用于丝绸之路风情城项目二期,--,城投债,102932,2024/9/24
平湖市国有资产控股集团有限公司,PHSOAH 2.2 09/24/24,96.312,2.2,4.065,300.00 百万,2021/9/24,用于项目的建设和补充营运资金,--,城投债,102933,2024/9/24
北京环境卫生工程集团有限公司,BJESEG 1.65 09/24/24,94.668,1.65,4.353,230.00 百万,2021/9/24,根据担保人的绿色融资框架为集团的离岸债务进行再融资,--,产业债,102934,2024/9/24
中国工商银行股份有限公司,ICBCAS 3.2 PERP,96.074,3.2,4.257,6160.00 百万,2021/9/24,根据相关监管要求，净收益将计入该行的AT1资本,2026/9/24、2027/3/24、2027/9/24、2028/3/24、2028/9/24、2029/3/24、2029/9/24、2030/3/24、2030/9/24、2031/3/24,金融债,102935,PERP
无锡恒廷实业有限公司,SIHAII 2.05 09/24/24,-,2.05,-,80.00 百万,2021/9/24,用于业务发展和项目投资建设的境内汇款,--,城投债,102943,2024/9/24
成都空港城市发展集团有限公司,SHLTIG 2.8 09/24/24,99.688,2.8,2.954,300.00 百万,2021/9/24,项目开发、偿还现有债务和补充营运资金,--,城投债,102944,2024/9/24
中国林业集团有限公司,CNFORE 5.5 09/24/24,-,5.5,-,50.00 百万,2021/9/24,--,--,城投债,102947,2024/9/24
香港中华煤气有限公司,HKCGAS 0.7 09/24/24,-,0.7,-,320.00 百万,2021/9/24,--,--,产业债,102908,2024/9/24
中化香港(集团)有限公司,SINOCH 2.375 09/23/31,79.714,2.375,5.207,500.00 百万,2021/9/23,为现有在岸债务再融资,2031/6/23,产业债,102912,2031/9/23
新城发展控股有限公司,FUTLAN 4.25 09/22/22,98.625,4.25,22.489,200.00 百万,2021/9/23,为发行人现有的美元高级票据进行再融资以及用于一般公司用途,--,地产债,102913,2022/9/22
国银租赁(国际)有限公司,CDBLFD 0.85 09/23/22,99.711,0.85,4.503,50.00 百万,2021/9/23,--,--,金融债,102914,2022/9/23
中国建设银行股份有限公司,CCB 2.8 09/23/22,-,2.8,-,500.00 百万,2021/9/23,--,--,金融债,104196,2022/9/23
济南城市建设集团有限公司,JNUCGC 2.4 09/23/26,91.406,2.4,4.742,305.00 百万,2021/9/23,偿还子公司济南西城投资开发集团有限公司发行的现有一年内到期的境外中长期债券,--,城投债,102924,2026/9/23
正商实业有限公司,ZENENT 12.5 04/23/24,-,12.5,-,160.00 百万,2021/9/23,对将于一年内到期的现有中长期境外债务进行再融资。,--,地产债,102936,2024/4/23
南京牛首山文化旅游集团有限公司,NJNSSW 2.05 09/23/24,-,2.05,-,150.00 百万,2021/9/23,再融资,--,城投债,102948,2024/9/23
禹洲集团控股有限公司,YUZHOU 8.5 09/22/22,7.843,8.5,-,120.00 百万,2021/9/23,用于为公司将于一年内到期的现有中长期境外债务再融资。,--,地产债,102955,2022/9/22
